title,content,URL,image
강아지 귀가려움증 빨갛고 부어오름 치료 강남동물병원,"강아지 귀가려움증 빨갛고 부어오름 치료 강남동물병원
강아지의 귀가 평소보다 빨갛고, 귀를 가려워 하는
경우가 많다면 귓병을 의심해 볼 수 있습니다.
만일 강아지의 귀 피부가 붉게 되어 있지 않은지, 귀지가
너무 많거나 냄새가 꽉 찼거나 귀를 가려우거나 머리를
자꾸 흔들지 않았는지 확인해 주세요.
#강아지귀가려움증
특히 늘어진 귀나 이도에 털이 많이 나고 있는 아이는,
외이염이 되기 쉬운 경향에 있습니다.
또, 딱지가 생기고 있는지, 가려움이 있거나 하지
않는지를 자주 체크해 볼 필요가 있습니다.
강아지의 귓병은 다양한 원인에 의한 피부염이나
다른 질병, 영양 부족 등에서도 일어납니다.
#강아지귓병
귀를 청결하게 유지함으로써 외이염의 예방을 기대
할 수 있습니다.
그러나 잘못된 방법으로 귀 청소나 샴푸액이 귀로
유입 되었던가 등이 외이염을 일으키는 원인이
될 수 있으므로 주의가 필요 합니다.
#강아지귓병원인
귀 청소의 포인트는 강아지 귀의 더러움이 눈에 띄는
경우에는 손가락이 닿는 범위를 부드럽게 닦아 내는
정도로 해 주십시오.
귀지가 많고 심한 냄새도 난다면, 빨리 동물 병원을
찾아 진찰 받도록 해주세요.
#강아지귀검사
피부의 케어 등으로 샴푸를 할 때는, 가능한 한 귀안에
샴푸액이 들어가지 않게 하세요.
만약 샴푸액이 귀에 들어갔을 경우에는, 제대로 씻어
흘려, 손가락이 닿는 범위에서 조심스럽게 귀 속의
수분을 닦아 주세요.
#강아지귀관리
각 질병에 따라 증상과 치료법도 다릅니다.
매일 귀의 상태를 확인하고 ""평소와 다르다""고 느끼면
병원에 데려가 적절한 검사를 실시하고 원인을 확실히
파악하여 조기에 치료를 받도록 해주는 것이 우리
강아지 귀의 건강을 위해 중요 합니다.
#강남강아지동물병원
모든 동물을 특별하게 케어하는
최영민동물병원
진료문의는 전화로 안내해 드립니다.
최영민동물병원 오시는 길
50m
© NAVER Corp.
최영민동물의료센터
서울특별시 강남구 논현로132길 24 양현빌딩2층 최영민동물의료센터",https://m.blog.naver.com/vet6390/223021737298?referrerCode=1,https://mblogthumb-phinf.pstatic.net/MjAyMzAyMjBfMjE4/MDAxNjc2ODcyNTMzNDgw.QD1EtFC-krdCWb9ElUXTYi9h3jFd9Y-hqbz2-gZgUxEg.I24wp_C9n-0PNgIzXcS6Bh7XSZvf0MtXBeiMIHcgwbQg.PNG.vet6390/%EA%B0%95%EC%95%84%EC%A7%80_%EA%B7%80%EA%B0%80%EB%A0%A4%EC%9B%80%EC%A6%9D_%EA%B7%93%EB%B3%91_%EC%B9%98%EB%A3%8C.PNG?type=w800
강아지 노령견 주의 질병 반려견 주의 질환 증상과 검진 강남동물병원,"강아지 노령견 주의 질병 반려견 주의 질환 증상과 검진 강남동물병원
농촌진흥청이 11개 동물병원의 진료 기록을 분석한
결과를 보면 7세 이상 노령견 때부터 심장, 신장 질환,
유선종양, 부신피질기능항진증이 나타날 수 있습니다.
특히 자궁축농증, 백내장 등의 발생이 급격하게
늘어난다고 합니다.
#노령경질병
이 같은 노령견 질병은 겉으로 드러나지 않아서
병세를 한참 키운 후에야 진료를 받는 경우가
많았다고 합니다.
그래서 정기 검진을 받거나 반려견의 행동을
세심하게 살피는 것이 중요합니다.
나이든 노령견이 주의해야 할 6대 질병은 심장과
신장 질환, 부신피질기능항진증, 유선종양,
자궁축농증, 백내장이 대표적인 질환 입니다.
그렇다면 이런 질병의 증상은 어떤 것들이 있을까요?
#노령견질환
이에 대해 잘 알고 있으면 보호자가 관찰하여 조기에
질병을 치료 하는데 효과적 입니다.
심장질환을 앓는 경우 가벼운 운동을 하더라도 쉽게
지치는 것을 볼 수 있습니다.
호흡이 빨라지고, 밤에 기침이 잦습니다.
보통 대형견보다 소형견에서 많이 나타나는 질환
입니다.
#노령견심장질환
신장 질환이 있는 반려견은 물 마시는 횟수가 늘거나
배뇨가 잦을 수 있습니다.
간혹 혈뇨를 보기도 합니다.
부신피질기능항진증은 노령견에게 흔한 호르몬 기능
장애로 근력이 약해지고 피부가 얇아지면서 탄력이
떨어집니다.
유선종양이나 자궁축농증은 중성화하지 않는 암컷
반려견에게 나타나는 대표적인 질환으로 약 50%가
악성인 경우가 있어 조기 치료가 중요합니다.
갑작스러운 식욕부진, 구토, 복부 팽만 등을 보인다고 합니다.
#노령견자궁축농증
마지막으로 백내장은 수정체가 탁해지면서 시력이
떨어지고 움직임이 조심스럽거나 자주 부딪힌다면
백내장일 수 있습니다.
이럴 경우에는 백내장을 의심해 볼 필요가 있습니다.
반려견의 상태에 따라서 치료가 가능하고 꼭 필요한
경우 일 수 있으니까 꼭 수의사의 상담을 받아보는 게
좋습니다.
강남 지역민 이시라면 최영민 동물병원으로 오셔서
검진과 상담을 받아보시길 바랍니다.
#강남노령견치료
모든 동물을 특별하게 케어하는
최영민동물병원
진료문의는 전화로 안내해 드립니다.
최영민동물병원 오시는 길
50m
© NAVER Corp.
최영민동물의료센터
서울특별시 강남구 논현로132길 24 양현빌딩2층 최영민동물의료센터",https://m.blog.naver.com/vet6390/223020076964?referrerCode=1,https://mblogthumb-phinf.pstatic.net/MjAyMzAyMThfNzMg/MDAxNjc2NzA2MTI1MjY3.8_fCTgHizXSMIetaQKkGTjCUMT0wWUXJAJxjYsl9cVEg.iRWWVpspHd9Ktm5IC0gGmaPG5HP-OADgZSP-hE-tMrIg.JPEG.vet6390/%EA%B0%95%EB%82%A8_%EB%85%B8%EB%A0%B9%EA%B2%AC_%EC%A0%84%EB%AC%B8_%EC%B9%98%EB%A3%8C_%EB%8F%99%EB%AC%BC%EB%B3%91%EC%9B%90.jpeg?type=w800
강아지 종양 반려견 암검진 치료 강남 동물병원,"강아지 종양 반려견 암검진 치료 강남 동물병원
사람과 마찬가지로 반려견의 종양은 신체 어느
부위에나 생길 수 있습니다.
강아지의 암 중 가장 많은 것이 체표에 나타나는
피부와 유선의 암 입니다.
#강아지종양
피부에 발생한 종양은 붓기나 덩어리가 보이기
때문에, 비교적 찾아내기 쉽지만 체내에 발생한
암은 밖으로 보이지 않기 때문에 보호자의
주의가 필요 합니다.
보호자의 관찰 시 체크할 부분은 암에 걸린 반려견은
기본적으로 활력 저하, 식욕 부진, 구토 설사, 악취,
체중 저하, 특이한 색깔의 변 등이 나타납니다.
#강아지의암
강아지에게 특히 잘 발생하는 3대 암종은 악성림프종,
피부암, 유선종양. 구강부터 흉부 복강과 골조직 등
거의 모든 장기에 암이 발생할 수 있습니다.
특히 나이든 반려견의 피부에서 덩어리가 발견된다면
꼭 병원에 데리고 가서 암 여부를 검진하여 확인해 볼
필요가 있습니다.
#강아지암검진
바디 체크나 움직임 방법(걷는 방법)의 관찰 등으로
신경이 쓰이는 곳이 있는 경우나, 몸에 분명히 덩어리의
감촉이 있는, 걱정인 것이 있다고 하는 경우는,
빨리 동물 병원에서 진찰해서 수의사와 상담하는 것이
좋습니다.
이러한 진단을 바탕으로 암의 진행도를 판정합니다.
암의 진행도(임상 병기)의 판정에는, 병리학적 판단과
함께 종양의 크기, 주위의 림프절에의 침윤, 및 전이의
유무가 중요합니다.
그것을 바탕으로 치료 방침을 결정합니다.
#강아지암치료
암의 치료법의 경우 수술이나 항암제 투여, 방사선
요법 등이 있습니다.
#강남강아지동물병원
모든 동물을 특별하게 케어하는
최영민동물병원
진료문의는 전화로 안내해 드립니다.
최영민동물병원 오시는 길
50m
© NAVER Corp.
최영민동물의료센터
서울특별시 강남구 논현로132길 24 양현빌딩2층 최영민동물의료센터",https://m.blog.naver.com/vet6390/223017799050?referrerCode=1,https://mblogthumb-phinf.pstatic.net/MjAyMzAyMTZfMjAy/MDAxNjc2NTMwNDc2NDg5.ww_0SucPq1BBOPuChqqPlcveBfm3v5W_uvtjYUvX1rEg.huCRxlNSi25e7O_cxJS-JQ9KvkfuSEaHoVmGa1n_sxgg.JPEG.vet6390/%EA%B0%95%EC%95%84%EC%A7%80_%EC%A2%85%EC%96%91_%EB%B0%98%EB%A0%A4%EA%B2%AC_%EC%95%94%EA%B2%80%EC%A7%84.jpg?type=w800
강아지 탈모 가려움증 원인 곰팡이성 피부병 원인 치료 강남 동물병원,"강아지 탈모 가려움증 원인 곰팡이성 피부병 원인 치료 강남 동물병원
강아지가 흔하게 겪는 질환 중 하나가 피부병
입니다.
강아지가 피부병에 걸리면 주요 증상은 탈모와
가려움증을 보이는데요.
이외에도 비듬도 보이고 가려움증으로 심하게
긁다 보면 상처가 생겨서 세균감염이 될 수 있습니다.
#강아지탈모
이러한 강아지 피부병의 원인 중 곰팡이균이 원인이
되는 경우가 가장 많습니다.
강아지 곰팡이 피부병은 피부 각질층, 털 그리고 발톱에
진균(곰팡이)이 침입하여 발생하는 피부질환 입니다.
때로는 다른 피부병과 복합 감염되는 경우도 많습니다.
진균성 피부병은 사람에게도 감염되기 때문에 발견
즉시 격리 수용하며 조기 치료를 실시해야 합니다.
#강아지진균성피부병
강남 강아지 최영민 동물병원은 피부병의 원인 검사를
전문의의 축적된 임상경험과 실력을 통해, 최신 설비와
최첨단장비로 반려동물에게 발병하는 다양한 피부관련
질병을 정확하게 검진, 치료하고 있습니다.
#강아지피부병
검사를 정확히 판별하여 소독을 하고 먹는 약과 바르는
연고를 처방하여 치료 관리 합니다.
약물 치료를 통해 가려움증을 완화시키면서 피부병
증상을 완화할 수 있습니다.
곰팡이는 모낭의 영양을 먹고 자라기 때문에 모낭에
손상이 와서 감염 부위의 털이 동그랗게 빠지고 딱지나
비듬이 보입니다.
또한 가렵기 때문에 스트레스도 심하게 받기 때문에
조기에 치료가 필요합니다.
#강아지피부병치료
곰팡이성 피부염은 재발이 잦은데다 치료가 오래 걸릴
수 있으므로 피부병이 깊어지기 전에 조기에 치료할 수
있도록 빨리 동물병원으로 데리고 오시길 권해 드립니다.
TV동물농장 자문위원이신 최영민 원장님께 강아지를
위한 효과적인 치료를 받도록 해주세요~
#강남강아지동물병원
모든 동물을 특별하게 케어하는
최영민동물병원
진료문의는 전화로 안내해 드립니다.
최영민동물병원 오시는 길
50m
© NAVER Corp.
최영민동물의료센터
서울특별시 강남구 논현로132길 24 양현빌딩2층 최영민동물의료센터
이 블로그의 체크인
이 장소의 다른 글",https://m.blog.naver.com/vet6390/223206908835?referrerCode=1,https://mblogthumb-phinf.pstatic.net/MjAyMzA5MDlfMjM4/MDAxNjk0MjU2NjkxMzY0.tMfLbdp0QWelWRx6zJrmEAEz4cQ8xkFntQ3ouaP65wog.lt6be9RASGugnZsFQPoqDiQ8VvpedRteZ2mCwR2SwKEg.PNG.vet6390/%EA%B0%95%EB%82%A8_%EA%B0%95%EC%95%84%EC%A7%80_%ED%94%BC%EB%B6%80%EB%B3%91_%EC%B9%98%EB%A3%8C.PNG?type=w800
강아지 구토 설사 원인 식중독 증상 치료 강남 동물병원,"강아지 구토 설사 원인 식중독 증상 치료 강남 동물병원
강아지가 식중독에 걸리면 나타나는 대표적인 증상은
구토와 설사 증상 입니다.
특히 사료 관리를 잘 못해서 사료가 산패 하거나
이물질이 들어가는 경우에 식중독에 걸릴 가능성이
높습니다.
#강아지식중독
식중독이 발병하면 구토와 설사 외에도 장염으로
악화되어 탈수가 되어 기력쇠진으로 축 늘어지게
됩니다.
이밖에도 식욕부진, 피부발진, 부종 등이 나타날 수
있고 심할 경우 다른 질환이 동반되거나 호흡곤란이
오기도 합니다.
#강아지식중독증상
식중독이 의심될 때는 우선 물을 제외하고는 음식을
주지말고 금식을 시켜야 합니다.
또한 식중독 증상이 나타났다면 바로 동물병원에
데리고 오셔서 치료를 받도록 해주세요.
#강아지식중독치료
사료를 상온에 오래 두면 각종 세균에 의해 부패
하는데 건사료를 제대로 밀봉하지 않으면 곰팡이가
생기고 부패하는 것을 잘 알고 계셔야 합니다.
사료는 잘 밀봉하여 서늘한 곳에 보관토록 해야
합니다.
식중독 예방을 위해 청결한 환경도 중요합니다.
반려견이 지내는 장소와 사용하는 도구를 항상 깨끗
하게 청소하고 세척 후 건조해 줘야 합니다.
#강아지식중독관리
또한 강아지가 아무것나 먹지 못하도록 세심하게
관찰하며 사람이 먹는 음식을 아무거나 막 줘서도
안됩니다.
식중독은 보호자가 관리를 통해 예방할 수 있습니다.
그럼에도 불구하고 구토, 설사 등 식중독 의심 증상이
나타나면 언제 증상이 나타났고 무엇을 먹었는지
잘 체크하여 동물병원에 데리고 오셔서 수의사에게
알려주시는 것이 빠른 진료와 치료에 도움이 됩니다.
#강아지식중독치료병원
모든 동물을 특별하게 케어하는
최영민동물병원
진료문의는 전화로 안내해 드립니다.
최영민동물병원 오시는 길
50m
© NAVER Corp.
최영민동물의료센터
서울특별시 강남구 논현로132길 24 양현빌딩2층 최영민동물의료센터
이 블로그의 체크인
이 장소의 다른 글",https://m.blog.naver.com/vet6390/223204684520?referrerCode=1,https://mblogthumb-phinf.pstatic.net/MjAyMzA5MDdfMTMw/MDAxNjk0MDQ2MjU0NDk1.b9HKSEX-U0s27gVk0y6e1gcLn5mHmsZJVEEMuSN8GB8g.bVHIOCesHScJK6ye9i52dz_6dhHKoqU_0tAn6bJRCf8g.PNG.vet6390/%EA%B0%95%EB%82%A8_%EA%B0%95%EC%95%84%EC%A7%80_%EC%8B%9D%EC%A4%91%EB%8F%85_%EC%B9%98%EB%A3%8C_%EB%8F%99%EB%AC%BC%EB%B3%91%EC%9B%90.PNG?type=w800
강아지 구강종양 증상 입안에 발생한 구강암 반려견 치료 강남동물병원,"강아지 구강종양 증상 입안에 발생한 구강암 반려견 치료 강남동물병원
강아지 압안에 종양이 발생할 수 있는데 입안 뿐 아니라
입술이나 혀, 잇몸, 구강 내 림프조직에 생기는 종양을
구강종양 이라고 합니다.
#강아지구강종양
종양은 크게 악성과 양성으로 나뉘어 지는데
악성이 아니더라도 조기에 치료하지 않으면
악성이 되어서 다른 기관에 전이될 수 있으므로
주의가 필요합니다.
양성은 잇몸에 생기는 에프리스, 유두종이 있으며
악성은 악성 흑색종, 편평상피암, 섬유육종 등이 있습니다.
#강아지구강암
구강종양이 발생하면 몇가지 증상을 보이는데
대표적으로 입안에 혹이나 종기가 생겨 점막이
문드러져 보이며 과도한 침흘림과 구내에 악취가
풍깁니다.
음식물을 잘 먹지 못하며 이로인해 체중이 감소하며
식욕김퇴가 일어납니다.
입에서 피가 나며 잘 씹지 못하고 입을 열고 다무는
것을 잘 못합니다.
물론 종양이 있어도 아무런 증상을 보이지 않을 수도
있습니다.
#강아지입냄새심한이유
악성 종양인 흑색종의 경우 점막이나 혀에 발생하며
검은 색의 종양의 모습으로 급속하게 성장하여
폐나 림프관에 전이되는 경우가 많습니다.
치료를 위해서는 동물병원에서 검사를 통해
양성인지 음성인지 판별해야 합니다.
악성 종양의 경우 수술을 통해 제거해야 하는데
만일 시기가 늦어 턱뼈까지 번지게 되면 턱뼈도
포함해서 종양을 적출해야 합니다.
#강아지구강암수술
빠르게 발견하여 조기에 수술과 방사선 치료를 하면
높은 성공률로 예후가 좋습니다.
하지만 늦게 발견하여 악성종양이 후기로 판명되면
항암 화학요법이나 방사선 치료법을 병행하여
치료율은 종양의 종류와 위치, 전이 여부에 따라
상이하게 달라질 수 있습니다.
따라서 보호자는 치아관리를 위해 칫솔질을 해주면서
입안에 종기나 궤양은 없는지 살펴봐 주시길 바랍니다.
#강아지구강암예방
TV동물농장 자문위원이신 최영민 원장님께 강아지를
위한 효과적인 치료를 받도록 해주세요~
#강남강아지동물병원
모든 동물을 특별하게 케어하는
최영민동물병원
진료문의는 전화로 안내해 드립니다.
최영민동물병원 오시는 길
50m
© NAVER Corp.
최영민동물의료센터
서울특별시 강남구 논현로132길 24 양현빌딩2층 최영민동물의료센터
이 블로그의 체크인
이 장소의 다른 글",https://m.blog.naver.com/vet6390/223202258679?referrerCode=1,https://mblogthumb-phinf.pstatic.net/MjAyMzA5MDRfMTc3/MDAxNjkzODE5MzM0NDY5.1Pw67wtpt_m6_dUJP2BGSjHYqYy5fooIz3iv8cMLeucg.arpJuzBzOSEiGxSZAG9iRdYsfTxuJ0bjo21xu7EEM_8g.JPEG.vet6390/%EA%B0%95%EB%82%A8_%EA%B0%95%EC%95%84%EC%A7%80_%EA%B5%AC%EA%B0%95%EC%95%94_%EC%B9%98%EB%A3%8C.jpg?type=w800
강아지 귀질환 이개혈종 귀가 붓고 통증 있는 귓병 치료 강남동물병원,"강아지 귀질환 이개혈종 귀가 붓고 통증 있는 귓병 치료 강남동물병원
강아지 귀질환은 여러가지 증상으로 나타나는데요.
이중 이개혈종은 매우 흔한 강아지 귓병으로 귀를
계속 뒷발로 긁고 냄새를 맡으며 귀를 자주 흔들어
대는 모습을 보입니다.
#강아지귀질환
이개혈종이 나타나면 강아지의 귀는 퉁퉁 부어오르며
귀를 수시로 흔들어 대묘 벽면이나 바닥 등에 귀를
비벼 대기도 합니다.
귓바퀴에 혈관이 파괴되기 때문에 내출혈로 인해
귀가 퉁퉁 붓고 낑낑 거리며 통증으로 괴로워 합니다.
#강아지귀통증
피고름이 강아지의 귀에 가득차기 때문에 보호자가
만지면 매우 괴로워합니다.
이러한 이개혈종은 특히 큰 귀를 가진 품종에서
발생하기 쉽습니다.
#강아지이개혈종
귀에 심한 자극과 충격이 지속되면 귀에 혈종이
생기는데 이를 제때 제거하지 않으면 연골막에서
새로운 연골이 형성되며 섬유화가 진행됩니다.
이로인해 귀모양이 변하게 되는데 유도나 레슬링을
하는 선수들의 귀모양이 이런 이유 때문입니다.
이런 귀를 일면 만두귀라고 부르는데 귀가 마치
만두처럼 부풀어 오르기 때문입니다.
#강아지귓병
이개혈종의 치료는 피고름을 빼내는 치료를 하고
1주 이상 붕대로 고정해야 합니다.
문제는 관리가 필요한데 붕대를 자꾸 강아지가
풀어버리고 귀를 다시 긁으면서 재발하는 경우가
많습니다.
#강아지귓병치료
따라서 강아지 이개혈종 치료는 치료 뿐 아니라
관리가 매우 중요합니다.
자주 붕대를 갈아주고 병원에 주기적으로 내원하여
신경을 써야 하므로 보호자의 관심이 필요한 질환이
강아지 이개혈종 귀질환 입니다.
#강아지귀치료동물병원
TV동물농장 자문위원이신 최영민 원장님께 강아지를
위한 효과적인 치료를 받도록 해주세요~
#강남강아지동물병원
모든 동물을 특별하게 케어하는
최영민동물병원
진료문의는 전화로 안내해 드립니다.
최영민동물병원 오시는 길
50m
© NAVER Corp.
최영민동물의료센터
서울특별시 강남구 논현로132길 24 양현빌딩2층 최영민동물의료센터
이 블로그의 체크인
이 장소의 다른 글",https://m.blog.naver.com/vet6390/223199844340?referrerCode=1,https://mblogthumb-phinf.pstatic.net/MjAyMzA5MDFfODkg/MDAxNjkzNTU5Njc2Nzk3.K9P52q9OXMdA_P9amaeMnU2nxCzoJnnIrwxvp9Nbzxcg.EDLc6ztHWupAs-1-1s1Si30XEG1FW_HBfviU8Yr0SpIg.PNG.vet6390/%EA%B0%95%EC%95%84%EC%A7%80_%EA%B7%80%EC%A7%88%ED%99%98_%EC%9D%B4%EA%B0%9C%ED%98%88%EC%A2%85_%EC%B9%98%EB%A3%8C_%EA%B0%95%EB%82%A8%EB%8F%99%EB%AC%BC%EB%B3%91%EC%9B%90.PNG?type=w800
강아지 잇몸색 구강관리 건강 상태 체크,"강아지 잇몸색 구강관리 건강 상태 체크
일반적인 건강한 강아지의 잇몸은 깨끗한 분홍색을
띄면서 촉촉하고 매끈합니다.
하지만 다른 색의 잇몸을 보인다면 강아지의 건강
이상을 체크할 수 있습니다.
#강아지잇몸색
검은색 잇몸은 선천성으로 보일 수도 있는데
차우차우나 샤폐이 같은 견종의 경우 날때부터
잇몸이 검고 어두울 수 있습니다.
하지만 후천적으로 몸에 별다른 문제가 없어도
나이가 들면서 자연스럽게 잇몸이 어둡게
변할 수 있습니다.
단 갑자기 검은 반점이 생기거나 검은 부분이
부푼다면 구강종양인 흑색종을 의심해야 합니다.
#강아지구강관리
붉은 색의 잇몸은 딱딱한 음식이나 물건을
씹는 과정에서 치은염, 구내염, 열사병을
의심해 볼 수 있습니다.
창백한 잇몸은 빈혈이 발생하면 생깁니다.
빈혈의 원인은 외상과 혈뇨, 내부출혈로
발생하거나 골수문제로 기능이 떨어지고
신부전, 종양 등이 골수를 억압하게 되면
빈혈이 발생합니다.
이외에도 참진드기에 물려서 바베시아증이
발병하면 빈혈이 생길 수 있습니다.
#강아지건강상태
잇몸이 창백하면 목숨이 위험할 정도로 심각한
문제가 있을 가능성이 크기 때문에 즉시 동물병원에
방문하는 것이 꼭 필요합니다.
잇몸이 파란색, 보라색으로 변할 수 있습니다.
이런 증상을 청색증이라고 하는데 산소가 부족한
상태이므로 서둘러 치료를 받는 것이 필요합니다.
#강아지구강치료
노란색 잇몸은 황달의 증상 입니다.
간경화나 간염 등 간이 손상되면 노란색 잇몸을
띄게 됩니다.
위와 같이 잇몸 색이 변하면 건강 상태의 이상신호
이므로 보호자의 세심한 관찰과 동물병원으로
빨리 데려가시는 것이 중요합니다.
TV동물농장 자문위원이신 최영민 원장님께 강아지
를 위한 효과적인 치료를 받도록 해주세요~
#강남강아지동물병원 #강아지건강검진
모든 동물을 특별하게 케어하는
최영민동물병원
진료문의는 전화로 안내해 드립니다.
최영민동물병원 오시는 길
50m
© NAVER Corp.
최영민동물의료센터
서울특별시 강남구 논현로132길 24 양현빌딩2층 최영민동물의료센터
이 블로그의 체크인
이 장소의 다른 글",https://m.blog.naver.com/vet6390/223197479340?referrerCode=1,https://mblogthumb-phinf.pstatic.net/MjAyMzA4MzBfMjY5/MDAxNjkzMzY0MDQ4MzQ2.pUTaZnmcpVNH0bn_WvZ1-WeFti89PHU62cfilAfinYwg.XQJWmEhsPFiZcEFo6Bkjmupu5WAoPoWGGFnwj2rgoH0g.PNG.vet6390/%EA%B0%95%EC%95%84%EC%A7%80_%EC%9E%87%EB%AA%B8%EC%83%89_%EA%B5%AC%EA%B0%95%EA%B4%80%EB%A6%AC.PNG?type=w800
