title,content,URL,image
강아지 귀질환 이개혈종 귀가 붓고 통증 있는 귓병 치료 강남동물병원,"강아지 귀질환 이개혈종 귀가 붓고 통증 있는 귓병 치료 강남동물병원
강아지 귀질환은 여러가지 증상으로 나타나는데요.
이중 이개혈종은 매우 흔한 강아지 귓병으로 귀를
계속 뒷발로 긁고 냄새를 맡으며 귀를 자주 흔들어
대는 모습을 보입니다.
#강아지귀질환
이개혈종이 나타나면 강아지의 귀는 퉁퉁 부어오르며
귀를 수시로 흔들어 대묘 벽면이나 바닥 등에 귀를
비벼 대기도 합니다.
귓바퀴에 혈관이 파괴되기 때문에 내출혈로 인해
귀가 퉁퉁 붓고 낑낑 거리며 통증으로 괴로워 합니다.
#강아지귀통증
피고름이 강아지의 귀에 가득차기 때문에 보호자가
만지면 매우 괴로워합니다.
이러한 이개혈종은 특히 큰 귀를 가진 품종에서
발생하기 쉽습니다.
#강아지이개혈종
귀에 심한 자극과 충격이 지속되면 귀에 혈종이
생기는데 이를 제때 제거하지 않으면 연골막에서
새로운 연골이 형성되며 섬유화가 진행됩니다.
이로인해 귀모양이 변하게 되는데 유도나 레슬링을
하는 선수들의 귀모양이 이런 이유 때문입니다.
이런 귀를 일면 만두귀라고 부르는데 귀가 마치
만두처럼 부풀어 오르기 때문입니다.
#강아지귓병
이개혈종의 치료는 피고름을 빼내는 치료를 하고
1주 이상 붕대로 고정해야 합니다.
문제는 관리가 필요한데 붕대를 자꾸 강아지가
풀어버리고 귀를 다시 긁으면서 재발하는 경우가
많습니다.
#강아지귓병치료
따라서 강아지 이개혈종 치료는 치료 뿐 아니라
관리가 매우 중요합니다.
자주 붕대를 갈아주고 병원에 주기적으로 내원하여
신경을 써야 하므로 보호자의 관심이 필요한 질환이
강아지 이개혈종 귀질환 입니다.
#강아지귀치료동물병원
TV동물농장 자문위원이신 최영민 원장님께 강아지를
위한 효과적인 치료를 받도록 해주세요~
#강남강아지동물병원
모든 동물을 특별하게 케어하는
최영민동물병원
진료문의는 전화로 안내해 드립니다.
최영민동물병원 오시는 길
50m
© NAVER Corp.
최영민동물의료센터
서울특별시 강남구 논현로132길 24 양현빌딩2층 최영민동물의료센터
이 블로그의 체크인
이 장소의 다른 글",https://m.blog.naver.com/vet6390/223199844340?referrerCode=1,https://mblogthumb-phinf.pstatic.net/MjAyMzA5MDFfODkg/MDAxNjkzNTU5Njc2Nzk3.K9P52q9OXMdA_P9amaeMnU2nxCzoJnnIrwxvp9Nbzxcg.EDLc6ztHWupAs-1-1s1Si30XEG1FW_HBfviU8Yr0SpIg.PNG.vet6390/%EA%B0%95%EC%95%84%EC%A7%80_%EA%B7%80%EC%A7%88%ED%99%98_%EC%9D%B4%EA%B0%9C%ED%98%88%EC%A2%85_%EC%B9%98%EB%A3%8C_%EA%B0%95%EB%82%A8%EB%8F%99%EB%AC%BC%EB%B3%91%EC%9B%90.PNG?type=w800
강아지 잇몸색 구강관리 건강 상태 체크,"강아지 잇몸색 구강관리 건강 상태 체크
일반적인 건강한 강아지의 잇몸은 깨끗한 분홍색을
띄면서 촉촉하고 매끈합니다.
하지만 다른 색의 잇몸을 보인다면 강아지의 건강
이상을 체크할 수 있습니다.
#강아지잇몸색
검은색 잇몸은 선천성으로 보일 수도 있는데
차우차우나 샤폐이 같은 견종의 경우 날때부터
잇몸이 검고 어두울 수 있습니다.
하지만 후천적으로 몸에 별다른 문제가 없어도
나이가 들면서 자연스럽게 잇몸이 어둡게
변할 수 있습니다.
단 갑자기 검은 반점이 생기거나 검은 부분이
부푼다면 구강종양인 흑색종을 의심해야 합니다.
#강아지구강관리
붉은 색의 잇몸은 딱딱한 음식이나 물건을
씹는 과정에서 치은염, 구내염, 열사병을
의심해 볼 수 있습니다.
창백한 잇몸은 빈혈이 발생하면 생깁니다.
빈혈의 원인은 외상과 혈뇨, 내부출혈로
발생하거나 골수문제로 기능이 떨어지고
신부전, 종양 등이 골수를 억압하게 되면
빈혈이 발생합니다.
이외에도 참진드기에 물려서 바베시아증이
발병하면 빈혈이 생길 수 있습니다.
#강아지건강상태
잇몸이 창백하면 목숨이 위험할 정도로 심각한
문제가 있을 가능성이 크기 때문에 즉시 동물병원에
방문하는 것이 꼭 필요합니다.
잇몸이 파란색, 보라색으로 변할 수 있습니다.
이런 증상을 청색증이라고 하는데 산소가 부족한
상태이므로 서둘러 치료를 받는 것이 필요합니다.
#강아지구강치료
노란색 잇몸은 황달의 증상 입니다.
간경화나 간염 등 간이 손상되면 노란색 잇몸을
띄게 됩니다.
위와 같이 잇몸 색이 변하면 건강 상태의 이상신호
이므로 보호자의 세심한 관찰과 동물병원으로
빨리 데려가시는 것이 중요합니다.
TV동물농장 자문위원이신 최영민 원장님께 강아지
를 위한 효과적인 치료를 받도록 해주세요~
#강남강아지동물병원 #강아지건강검진
모든 동물을 특별하게 케어하는
최영민동물병원
진료문의는 전화로 안내해 드립니다.
최영민동물병원 오시는 길
50m
© NAVER Corp.
최영민동물의료센터
서울특별시 강남구 논현로132길 24 양현빌딩2층 최영민동물의료센터
이 블로그의 체크인
이 장소의 다른 글",https://m.blog.naver.com/vet6390/223197479340?referrerCode=1,https://mblogthumb-phinf.pstatic.net/MjAyMzA4MzBfMjY5/MDAxNjkzMzY0MDQ4MzQ2.pUTaZnmcpVNH0bn_WvZ1-WeFti89PHU62cfilAfinYwg.XQJWmEhsPFiZcEFo6Bkjmupu5WAoPoWGGFnwj2rgoH0g.PNG.vet6390/%EA%B0%95%EC%95%84%EC%A7%80_%EC%9E%87%EB%AA%B8%EC%83%89_%EA%B5%AC%EA%B0%95%EA%B4%80%EB%A6%AC.PNG?type=w800
강아지 운동장애 경련 사비마비 발작 증상 원인 뇌수두증 치료 강남동물병원,"강아지 운동장애 경련 사비마비 발작 증상 원인 뇌수두증 치료 강남동물병원
강아지가 경련을 지속하고 의식을 잃는 사례가
빈번하다면 뇌수두증을 의심하고 MRI 검진을
통해 면밀히 살펴봐야 합니다.
#강아지운동장애경련
뇌수두증의 증상은 강아지가 식욕저하, 수면증가,
활동저하, 운동장애, 둔감, 시각소실, 우울감과 흥분
의식변화, 시각장애, 강직성 마비, 발작 등이
나타날 수 있습니다.
뇌수두증의 원인은 뇌의 뇌실에 뇌척수액이
채워져 있어야 하지만 뇌척수액의 흐름이 막혀 있거나
생성과 흡수의 균형이 깨져 뇌압이 상승하는 경우
뇌수두증이 발생합니다.
#강남강아지수술병원
뇌수두증의 치료를 위해서는 약물이나 수술로 증상을
완화할 수 있는데 약물치료는 수술이 불가능하거나
급성 증상이 나타날 때 시도해볼 수 있습니다.
약물로 뇌척수액의 생산을 줄이고 발작이 동반된 경우
항경련제를 처방합니다.
#강남강아지뇌수두증치료
약물은 내성이 생기거나 전해질 장애가 나타날 수
있어 장기간 사용은 치료반응을 저하할 수 있습니다.
수술적인 방법은 뇌실에 복강과 연결되는 관을 삽입해
뇌실 내 과하게 축적되는 뇌척수액을 복강으로 배액
하여 지속적인 감압이 이뤄질 수 있게 합니다.
수술 후 감염이나 배액관의 폐색, 과배액으로 인한
뇌압 감소와 같은 부작용이 발생할 수 있어 증상에
대한 면밀한 모니터링이 필요합니다.
#강아지발작원인치료
선천적으로 발생하는 뇌수두증은 주로 사과처럼
둥근 머리를 하고 주둥이가 짧은 치와와나 포메라니안,
시추, 몰티즈와 같은 소형견에게서 선천적으로
뇌구조 이상으로 발생하는 경우가 많기 때문에
보호자의 주의가 필요합니다.
TV동물농장 자문위원이신 최영민 원장님께 강아지를
위한 효과적인 치료를 받도록 해주세요~
#강남강아지동물병원
모든 동물을 특별하게 케어하는
최영민동물병원
진료문의는 전화로 안내해 드립니다.
최영민동물병원 오시는 길
50m
© NAVER Corp.
최영민동물의료센터
서울특별시 강남구 논현로132길 24 양현빌딩2층 최영민동물의료센터
이 블로그의 체크인
이 장소의 다른 글",https://m.blog.naver.com/vet6390/223195795296?referrerCode=1,https://mblogthumb-phinf.pstatic.net/MjAyMzA4MjhfMTUz/MDAxNjkzMjExNDIyNjY2.zxutAn16jFz_tM4JM_sOElkBb_IZx7m67anBkevxL2Ug.5RlprrnTyZhClTCQajcj6Df-p0E7xNbqgRGjO8XLvNkg.PNG.vet6390/%EA%B0%95%EC%95%84%EC%A7%80_%EB%B0%9C%EC%9E%91_%EA%B2%BD%EB%A0%A8_%EC%9A%B4%EB%8F%99_%EC%9E%A5%EC%95%A0_%EC%B6%94%EC%B2%9C.PNG?type=w800
강아지 기력쇠진 체중감소 당뇨병 증상과 검진 치료 관리 강남동물병원,"강아지 기력쇠진 체중감소 당뇨병 증상과 검진 치료 관리 강남동물병원
강아지 당뇨병은 비만, 유전, 췌장의 손상, 감염 등의
원인으로 체내 에너지대사에 문제가 생기는 질환입니다.
채내의 췌장에서는 인슐린 호르몬을 분비하면서 혈당
수치를 내립니다.
이렇게 분비되는 인슐린 호르몬이 부족하면 당뇨병이
발병 합니다.
#강아지당뇨병
강아지가 당뇨병에 걸리면 식욕과 소변양 증가하고
무기력함과 기력쇠진 그리고 체중이 감소되는 것이
가장 대표적인 증상 입니다.
혈당이 급격하게 떨어지면서 먹는 것을 통해 체내
에너지원인 당을 공급받기 때문에 끊임없이 먹으려고
하지만 먹는 것에 반해서 살이 찌지 않고 체중감소를
보입니다.
이런 증상들이 보이면 꼭, 병원에 데리고 오셔서
혈액, 소변 검사를 받아봐야 합니다.
#강아지체중감소원인
동물병원에서 검진 후 당뇨병이 판명되면 혈당에 맞게
사료량과 인슐린양을 알려 드립니다.
정해진 사료량을 급여하면서 인슐린 주사를 놓아 주게
됩니다.
진료 시 인슐린의 사용법, 주사법, 보관법 등애 대한
보호자 교육이 이루어지며 일단 혈당이 안정적으로
잡히면 매 6개월 마다 다시 내원하여 혈당을 재측정
하게 됩니다.
#강아지당뇨관리
강아지 당뇨병은 적정량의 인슐린만 잘 주사한다면
충분히 오랜 기간 건강한 생존이 가능한 질병입니다.
하지만 당뇨병은 제대로 관리가 되지 않으면
당뇨병성 케톤산증 그리고 고혈당성 고삼투압 등이
진행되게 되는데 심각하면 사망에 이르는 무서운 질환
입니다.
따라서 꼭 강아지가 당뇨 증상을 보이면 동물병원으로
데리고 오셔서 검진 후 관리에 대한 상담을 받도록 하세요.
강아지 당뇨는 반려인의 관심과 사랑, 철저한 관리가
필요한 병이라는 점을 잊지 마세요.
#강남강아지치료병원
강아지 당뇨병의 치료는 기본적으로 식사요법과
인슐린투여를 통해 해야 하므로 강남 지역민이시라면
최영민 동물병원에서 수의사의 지시와 권고사항에
따라 투여를 진행하시길 권해 드립니다.
TV동물농장 자문위원이신 최영민 원장님께 강아지를
위한 효과적인 치료를 받도록 해주세요~
#강남강아지동물병원
모든 동물을 특별하게 케어하는
최영민동물병원
진료문의는 전화로 안내해 드립니다.
최영민동물병원 오시는 길
50m
© NAVER Corp.
최영민동물의료센터
서울특별시 강남구 논현로132길 24 양현빌딩2층 최영민동물의료센터
이 블로그의 체크인
이 장소의 다른 글",https://m.blog.naver.com/vet6390/223194812026?referrerCode=1,https://mblogthumb-phinf.pstatic.net/MjAyMzA4MjdfMjE0/MDAxNjkzMTI0MzQ3MzYz.xNSst4qRmgxqyiZdEr64nWOWz9KMOkPb4ElcUaqQErog.IaFbZId3YGObbxOzMo7K-CacRbj7H-7-5F40BuoktjIg.PNG.vet6390/%EA%B0%95%EB%82%A8_%EA%B0%95%EC%95%84%EC%A7%80_%EB%8B%B9%EB%87%A8%EB%B3%91_%EC%B9%98%EB%A3%8C_%EB%8F%99%EB%AC%BC%EB%B3%91%EC%9B%90.PNG?type=w800
새끼 강아지 폐렴 의심 증상 기침 콧물 구토 치료 강남동물병원,"새끼 강아지 폐렴 의심 증상 기침 콧물 구토 치료 강남동물병원
폐렴이란 폐에 염증이 생기는 질환 입니다.
페렴이 발병하면 심한 발열이 먼저 나타나며 심하면
호흡곤란으로 이어지면서 사망에 이를 수 있는데
어린 새끼 강아지에게는 매우 위험한 질병입니다.
#강아지폐렴
어린 강아지가 기침과 같은 가벼운 증상을 보일 때
조기에 병원에 데려와 폐렴으로 진행되지 않도록
적절한 치료를 받아야 합니다.
#강남강아지폐렴치료
강아지가 폐렴에 걸리는 다음과 같은 증상을 보입니다.
✓ 기침
✓ 누런 가래 배출
✓ 거친 숨소리
✓ 발열
✓ 식욕저하
✓ 체중감소
✓ 콧물
✓ 구토
#강아지폐렴증상
폐렴이 중증이 되면 폐속에 공기가 차기도 하기
때문에 배가 부풀어 오르는 증상을 보일 수도
있습니다.
만일 어린 강아지가 기침을 하고 숨소리가 좋지
않다면 빨리 병원으로 데려와 진료를 받도록 해주세요.
검진 후에 항생제, 진핵제, 거담제, 소염제 등을 투여
하고 안정을 취하는 치료를 합니다.
#강남강아지치료병원
강아지 폐렴을 일으키는 세균은 면역력이 약해지고
감기에 걸렸을 때 발병이 진행됩니다.
또한 전염성이 강하기 때문에 면역력이 약한
어린 새끼 강아지나 나이든 노령견은 더욱 취약합니다.
앞서 말씀 드린 증상이 의심될 시에는 집에 방치하지
마시고 반드시 병원으로 데리고 오세요.
강남 지역민들께서는 TV동물농장 자문위원이신
최영민 원장님께 강아지를 위한 효과적인 치료를
받도록 해주세요~
#강남강아지동물병원
모든 동물을 특별하게 케어하는
최영민동물병원
진료문의는 전화로 안내해 드립니다.
최영민동물병원 오시는 길
50m
© NAVER Corp.
최영민동물의료센터
서울특별시 강남구 논현로132길 24 양현빌딩2층 최영민동물의료센터
이 블로그의 체크인
이 장소의 다른 글",https://m.blog.naver.com/vet6390/223194191073?referrerCode=1,https://mblogthumb-phinf.pstatic.net/MjAyMzA4MjZfMiAg/MDAxNjkzMDQyODgxMTEx.4Jx4W9MDfubVR_3P2aW56n5_fAjHTMO1Vf3139hlM2Qg.8liXmCUM5BbvqBm2DjyvsrYpdNkZNrKd1RwZ7cLSs_og.PNG.vet6390/%EA%B0%95%EC%95%84%EC%A7%80_%ED%8F%90%EB%A0%B4_%EC%A6%9D%EC%83%81_%EC%B9%98%EB%A3%8C.PNG?type=w800
강아지 구토 증상 응급상황 여부 파악 치료 강남동물병원,"강아지 구토 증상 응급상황 여부 파악 치료 강남동물병원
강아지는 사람보다 구토가 잦습니다.
너무 급하게 먹거나 이물을 먹었을 때 속이 안좋을 때
구토를 하는데요.
단순한 구토 증상은 강아지가 이물질을 체내에서
스스로 배출하려는 자연스러운 신체 반응 입니다.
#강아지구토
따라서 어린 강아지가 아닌 성견일 경우 강아지가
구토 시에는 물과 음식을 최소 2~3시간 정도는 주지
말고 금식을 시키고 경과를 관찰해 봅니다.
일시적이라면 구토 후에도 잘 놀고 잘 먹으면
평상시로 다시 돌아올 수 있습니다.
하지만 강아지가 무기력한 모습을 보이고 설사
증상이 나타난다면 특히 어린 새끼 강아지의 경우는
응급상황에 해당됩니다.
#강아지구토원인
강아지 구토의 응급상황은 다음과 같습니다.
✓ 하루 종일 구토가 지속 될 때
✓ 구토물에 피가 섞여 있을 경우
✓ 복통을 힘들어 할 때
✓ 배에서 소리가 계속 날 때
✓ 호흡이 가쁠 때
✓ 몸에 힘이 없고 계속 엎드려 있을 때
✓ 헛구역질을 지속할 때
✓ 구토액에 심한 냄새가 날 때
✓ 열이 있고 설사를 하면서 구토를 할 경우
#강아지응급상황
강아지 구토 이유는 우리가 아는 것보다 훨씬 다양한
원인 때문일 수 있습니다.
구토 뿐 아니라 무기력증과 설사 증상이 함께 한다면
여러 질병의 가능성이 있습니다.
응급상황의 가능성이 높기 때문에 반드시 수의사
선생님의 진료가 필요합니다.
#강남강아지치료병원
구토의 응급상황이 의심될 시에는 집에서 방치하지
마시고 반드시 병원으로 데리고 오세요.
강남 지역민들께서는 TV동물농장 자문위원이신
최영민 원장님께 강아지를 위한 효과적인 치료를
받도록 해주세요~
#강남강아지동물병원
모든 동물을 특별하게 케어하는
최영민동물병원
진료문의는 전화로 안내해 드립니다.
최영민동물병원 오시는 길
50m
© NAVER Corp.
최영민동물의료센터
서울특별시 강남구 논현로132길 24 양현빌딩2층 최영민동물의료센터
이 블로그의 체크인
이 장소의 다른 글",https://m.blog.naver.com/vet6390/223193103367?referrerCode=1,https://mblogthumb-phinf.pstatic.net/MjAyMzA4MjVfMTcx/MDAxNjkyOTMyMzE5NTMz.UfdcyCiyPsEEsIwlrwa0aIvBQUsS3CDfw8icSMbFoR0g.f6YUlD6HUSkyhNjzCH-Ec-hTK7NrsQtPCyVqoDqZIxcg.PNG.vet6390/%EA%B0%95%EC%95%84%EC%A7%80_%EA%B5%AC%ED%86%A0_%EC%9D%91%EA%B8%89%EC%83%81%ED%99%A9_%EC%B9%98%EB%A3%8C_%EB%B3%91%EC%9B%90.PNG?type=w800
강아지 마른 코 건조의 이유와 의심 질환 증상 치료 강남동물병원,"강아지 마른 코 건조의 이유와 의심 질환 증상 치료 강남동물병원
강아지를 보면 항상 코가 촉촉하게 젖어 있는 것을
볼 수 있습니다.
#강아지의젖은코
코가 젖어 있는 이유는 코를 통해 숨을 들이마시고
내쉴 때에 내뱉는 공기가 따듯하고 습도가 높기
때문에 코 표면의 체온보다 낮은 찬 성질로 인해서
수분이 코 주변에 응집되기 때문입니다.
또한 콧 속 점막에서 점액이 분비되어 이 점액이
윤활유 역활을 하여 냄새를 더 잘 맡게 해줍니다.
강아지는 수시로 코를 핥아 깨끗하게 유지하려는
습성이 있기 때문에 코가 계속 촉촉한 상태가
되는 것도 이유입니다.
#강아지코가축축한이유
하지만 강아지의 몸에 열이 나고 이상이 생기면
코가 마르고 건조해 집니다.
그렇다면 강아지의 코 건조에 따른 의심 질환은
어떤 것들이 있을 지 강남 최영민 동물병원에서
알려드립니다.
#강아지코건조의심증상
체온의 상승과 탈수증이 있는 경우
이런 증상에서 코가 마르고 무기력과 식욕감퇴가
함께 일어난다면 동물병원에서 진료를 받아야
합니다.
#강아지탈수증
비루관 이상
비루관은 코로 눈물이 나가는 길인데 이곳이 막히면
눈 주변은 과하게 젖지만 코는 건조해 집니다.
이런 비루관 이상에 취약한 품종은 말티즈와 푸들에게서
종종 나타납니다.
#강아지비루관이상
피부질환
피부에 질환이 생겼을 경우 코가 건조해질 수 있습니다.
코에 각질이 생기고 피부질환이 의심되면 소량의 바세린
을 발라주는 것도 개선에 도움이 됩니다.
건조한 환경
에어컨이나 히터 바람으로 인해 실내가 건조해지면
강아지의 코도 건조해 질 수 있습니다.
이런 경우는 사람의 안구건조증과 비슷합니다.
실내 온도와 함께 습도 관리를 해주시는 것이 좋습니다.
#강아지환경조성
마른 코는 강아지의 몸에 이상이 있다는 신호일수도
건강해도 코가 건조할 수 있는 환경적 요건일수도
있습니다.
다만 이런 마른코의 상태가 지속된다면 일시적인
상태가 아닌 컨디션의 문제일 수 있으므로 꼭
동물병원에 내원해서 검진을 받도록 해주세요.
강남 지역민 중 강아지의 검진을 받고자 하시는 분들
께서는 TV동물농장 자문위원이신 최영민 원장님께
강아지의 효과적인 치료를 맡겨보세요~
#강남강아지동물병원
모든 동물을 특별하게 케어하는
최영민동물병원
진료문의는 전화로 안내해 드립니다.
최영민동물병원 오시는 길
50m
© NAVER Corp.
최영민동물의료센터
서울특별시 강남구 논현로132길 24 양현빌딩2층 최영민동물의료센터
이 블로그의 체크인
이 장소의 다른 글",https://m.blog.naver.com/vet6390/223192066225?referrerCode=1,https://mblogthumb-phinf.pstatic.net/MjAyMzA4MjRfMjgg/MDAxNjkyODQwODIwMzA5.C-Yh5Z9FTqe0k9fNtV-0m1jLmMClPeTlxe7bJDRkRQAg.0qRk-nv7_x-r-1YlVbiP5HZKrHRz3xqO8K6koObcl0Ig.PNG.vet6390/%EA%B0%95%EC%95%84%EC%A7%80%EC%9D%98_%EB%A7%88%EB%A5%B8%EC%BD%94_%EC%9D%B4%EC%83%81_%EC%A6%9D%EC%83%81_%EA%B2%80%EC%A7%84_%EA%B0%95%EB%82%A8%EB%8F%99%EB%AC%BC%EB%B3%91%EC%9B%90.PNG?type=w800
나이든 강아지 노령견 안과 질환 백내장 치료 강남 동물병원 추천,"나이든 강아지 노령견 안과 질환 백내장 치료 강남 동물병원 추천
나이가 들고 장수하는 노령견이 늘어나면서 이에 대한
각종 질환도 늘어납니다.
#노령견질환
2021년 한국반려동물보고서 질환에 따르면 많은
노령견 질환 중에 안과질환을 앓는 노령견의
비율이 32.8%에 이르는 것으로 알려져 있습니다.
백내장 질환은 노령견 안과 질환 중 대표적인
질환 입니다.
백내장은 눈의 수정체가 흐려져서 시력이 저하되어
더 진행되면 실명하는 경우도 있습니다.
#노령견안과질환
백내장 질환의 주요한 증상은 계단을 내려가는데
주저하며 산책을 회피합니다.
벽이나 가구에 자주 부딪히거나 움직이는 것에
대한 반응이 둔해 집니다.
이런 증상들은 시력에 이상이 생겼을 때
노령견에게 나타날 수 있는 모습입니다.
이런 증상에 더해 눈동자가 하얗게 보인다면
의심질환 1순위는 바로 백내장 입니다.
#노령견백내장치료
백내장은 눈의 노화 질환으로 주로 10살 이상의
노령견에게 나타나는 대표적인 안과 질환으로
나이가 들어 발생하는 백내장과 달리 유전석
백내장은 주로 6살 미만의 강아지에게도 나타날 수
있는데 호발품종으로는 코커스패니얼과 푸들,
골든리트리버, 슈나우저, 비글 등에서 나타납니다.
이외 당뇨병성백내장은 당뇨를 앓는 강아지에게서
발생하는 합병증으로 일반 백내장 보다 진행속도가
빠릅니다.
#강아지당뇨병성백내장
백내장은 안약을 통해 백내장 진행을 늦추는 효과가
있지만 치료를 할 수는 없고 백내장을 완치할 수 있는
유일한 방법은 수술 입니다.
백내장 치료를 위해서는 노령견이 되면 일년에 한번
안과검진을 받도록 해주세요.
백내장은 조기에 발견해 적기에 치료하면 충분히
회복할 수 있습니다.
강남 지역민 중 노령견의 안과 질환 치료를 위해서는
TV동물농장 자문위원이신 최영민 원장님께 강아지의
효과적인 치료를 맡겨보세요~
#강남강아지동물병원
모든 동물을 특별하게 케어하는
최영민동물병원
진료문의는 전화로 안내해 드립니다.
최영민동물병원 오시는 길
50m
© NAVER Corp.
최영민동물의료센터
서울특별시 강남구 논현로132길 24 양현빌딩2층 최영민동물의료센터
이 블로그의 체크인
이 장소의 다른 글",https://m.blog.naver.com/vet6390/223189542983?referrerCode=1,https://mblogthumb-phinf.pstatic.net/MjAyMzA4MjFfMzYg/MDAxNjkyNjA3MTIyMTcy.pTGpqI7DMYDvErBvviI31kXLkdhVhvuwFwXYXCjEDJgg.tsdhg_nbcTMDxm79qt0iY78yfzF62asoihMMPdX6I9Eg.PNG.vet6390/%EB%85%B8%EB%A0%B9%EA%B2%AC_%EC%95%88%EA%B3%BC_%EC%A7%88%ED%99%98_%EC%B9%98%EB%A3%8C_%EA%B0%95%EB%82%A8%EB%B3%91%EC%9B%90.PNG?type=w800
