title,content,URL,image
강아지 마른 코 건조의 이유와 의심 질환 증상 치료 강남동물병원,"강아지 마른 코 건조의 이유와 의심 질환 증상 치료 강남동물병원
강아지를 보면 항상 코가 촉촉하게 젖어 있는 것을
볼 수 있습니다.
#강아지의젖은코
코가 젖어 있는 이유는 코를 통해 숨을 들이마시고
내쉴 때에 내뱉는 공기가 따듯하고 습도가 높기
때문에 코 표면의 체온보다 낮은 찬 성질로 인해서
수분이 코 주변에 응집되기 때문입니다.
또한 콧 속 점막에서 점액이 분비되어 이 점액이
윤활유 역활을 하여 냄새를 더 잘 맡게 해줍니다.
강아지는 수시로 코를 핥아 깨끗하게 유지하려는
습성이 있기 때문에 코가 계속 촉촉한 상태가
되는 것도 이유입니다.
#강아지코가축축한이유
하지만 강아지의 몸에 열이 나고 이상이 생기면
코가 마르고 건조해 집니다.
그렇다면 강아지의 코 건조에 따른 의심 질환은
어떤 것들이 있을 지 강남 최영민 동물병원에서
알려드립니다.
#강아지코건조의심증상
체온의 상승과 탈수증이 있는 경우
이런 증상에서 코가 마르고 무기력과 식욕감퇴가
함께 일어난다면 동물병원에서 진료를 받아야
합니다.
#강아지탈수증
비루관 이상
비루관은 코로 눈물이 나가는 길인데 이곳이 막히면
눈 주변은 과하게 젖지만 코는 건조해 집니다.
이런 비루관 이상에 취약한 품종은 말티즈와 푸들에게서
종종 나타납니다.
#강아지비루관이상
피부질환
피부에 질환이 생겼을 경우 코가 건조해질 수 있습니다.
코에 각질이 생기고 피부질환이 의심되면 소량의 바세린
을 발라주는 것도 개선에 도움이 됩니다.
건조한 환경
에어컨이나 히터 바람으로 인해 실내가 건조해지면
강아지의 코도 건조해 질 수 있습니다.
이런 경우는 사람의 안구건조증과 비슷합니다.
실내 온도와 함께 습도 관리를 해주시는 것이 좋습니다.
#강아지환경조성
마른 코는 강아지의 몸에 이상이 있다는 신호일수도
건강해도 코가 건조할 수 있는 환경적 요건일수도
있습니다.
다만 이런 마른코의 상태가 지속된다면 일시적인
상태가 아닌 컨디션의 문제일 수 있으므로 꼭
동물병원에 내원해서 검진을 받도록 해주세요.
강남 지역민 중 강아지의 검진을 받고자 하시는 분들
께서는 TV동물농장 자문위원이신 최영민 원장님께
강아지의 효과적인 치료를 맡겨보세요~
#강남강아지동물병원
모든 동물을 특별하게 케어하는
최영민동물병원
진료문의는 전화로 안내해 드립니다.
최영민동물병원 오시는 길
50m
© NAVER Corp.
최영민동물의료센터
서울특별시 강남구 논현로132길 24 양현빌딩2층 최영민동물의료센터
이 블로그의 체크인
이 장소의 다른 글",https://m.blog.naver.com/vet6390/223192066225?referrerCode=1,https://mblogthumb-phinf.pstatic.net/MjAyMzA4MjRfMjgg/MDAxNjkyODQwODIwMzA5.C-Yh5Z9FTqe0k9fNtV-0m1jLmMClPeTlxe7bJDRkRQAg.0qRk-nv7_x-r-1YlVbiP5HZKrHRz3xqO8K6koObcl0Ig.PNG.vet6390/%EA%B0%95%EC%95%84%EC%A7%80%EC%9D%98_%EB%A7%88%EB%A5%B8%EC%BD%94_%EC%9D%B4%EC%83%81_%EC%A6%9D%EC%83%81_%EA%B2%80%EC%A7%84_%EA%B0%95%EB%82%A8%EB%8F%99%EB%AC%BC%EB%B3%91%EC%9B%90.PNG?type=w800
나이든 강아지 노령견 안과 질환 백내장 치료 강남 동물병원 추천,"나이든 강아지 노령견 안과 질환 백내장 치료 강남 동물병원 추천
나이가 들고 장수하는 노령견이 늘어나면서 이에 대한
각종 질환도 늘어납니다.
#노령견질환
2021년 한국반려동물보고서 질환에 따르면 많은
노령견 질환 중에 안과질환을 앓는 노령견의
비율이 32.8%에 이르는 것으로 알려져 있습니다.
백내장 질환은 노령견 안과 질환 중 대표적인
질환 입니다.
백내장은 눈의 수정체가 흐려져서 시력이 저하되어
더 진행되면 실명하는 경우도 있습니다.
#노령견안과질환
백내장 질환의 주요한 증상은 계단을 내려가는데
주저하며 산책을 회피합니다.
벽이나 가구에 자주 부딪히거나 움직이는 것에
대한 반응이 둔해 집니다.
이런 증상들은 시력에 이상이 생겼을 때
노령견에게 나타날 수 있는 모습입니다.
이런 증상에 더해 눈동자가 하얗게 보인다면
의심질환 1순위는 바로 백내장 입니다.
#노령견백내장치료
백내장은 눈의 노화 질환으로 주로 10살 이상의
노령견에게 나타나는 대표적인 안과 질환으로
나이가 들어 발생하는 백내장과 달리 유전석
백내장은 주로 6살 미만의 강아지에게도 나타날 수
있는데 호발품종으로는 코커스패니얼과 푸들,
골든리트리버, 슈나우저, 비글 등에서 나타납니다.
이외 당뇨병성백내장은 당뇨를 앓는 강아지에게서
발생하는 합병증으로 일반 백내장 보다 진행속도가
빠릅니다.
#강아지당뇨병성백내장
백내장은 안약을 통해 백내장 진행을 늦추는 효과가
있지만 치료를 할 수는 없고 백내장을 완치할 수 있는
유일한 방법은 수술 입니다.
백내장 치료를 위해서는 노령견이 되면 일년에 한번
안과검진을 받도록 해주세요.
백내장은 조기에 발견해 적기에 치료하면 충분히
회복할 수 있습니다.
강남 지역민 중 노령견의 안과 질환 치료를 위해서는
TV동물농장 자문위원이신 최영민 원장님께 강아지의
효과적인 치료를 맡겨보세요~
#강남강아지동물병원
모든 동물을 특별하게 케어하는
최영민동물병원
진료문의는 전화로 안내해 드립니다.
최영민동물병원 오시는 길
50m
© NAVER Corp.
최영민동물의료센터
서울특별시 강남구 논현로132길 24 양현빌딩2층 최영민동물의료센터
이 블로그의 체크인
이 장소의 다른 글",https://m.blog.naver.com/vet6390/223189542983?referrerCode=1,https://mblogthumb-phinf.pstatic.net/MjAyMzA4MjFfMzYg/MDAxNjkyNjA3MTIyMTcy.pTGpqI7DMYDvErBvviI31kXLkdhVhvuwFwXYXCjEDJgg.tsdhg_nbcTMDxm79qt0iY78yfzF62asoihMMPdX6I9Eg.PNG.vet6390/%EB%85%B8%EB%A0%B9%EA%B2%AC_%EC%95%88%EA%B3%BC_%EC%A7%88%ED%99%98_%EC%B9%98%EB%A3%8C_%EA%B0%95%EB%82%A8%EB%B3%91%EC%9B%90.PNG?type=w800
강아지 디스크 관절 질환 취약품종 의심증상 치료 강남동물병원,"강아지 디스크 관절 질환 취약품종 의심증상 치료 강남동물병원
강아지 질환 중 디스크나 관절 질환에 취약한
품종이 있습니다.
몰티즈, 푸들, 요크셔테리어와 같은 견종은 뼈가
약한 품종이기 때문에 높은 곳에서 뛰거나
착지하는 과정에서 골절이 일어나기 쉽기 때문에
주의가 필요합니다.
#강아지질환
골절 외에도 슬개골탈구, 고관절탈구 등의 관절 질환과
디스크 질환에도 취약하므로 주의해야 합니다.
이중 디스크는 척추 추간판 탈출증이 정확한 병명으로
척추와 척추 사이의 추간판(디스크)이 튀어나와 신경을
압박하며 통증을 동반하고 신경이 손상되어 하지마비나
보행장애가 올 수 있습니다.
#강아지디스크질환
모델 겸 배우 배정남씨의 반려견 벨은 도베르만 품종
으로 역시 디스크 질환에 취약하여 사지마비가 와서
안타까운 소식을 전한 바 있습니다.
허리가 길고 다리가 짧은 소형견인 닥스훈트, 페키니즈,
시츄, 비글 등과 대형견인 셰퍼드, 도베르만, 골든
리트리버 등도 디스크 질환에 취약한 견종 입니다.
강아지의 디스크 질환이 위험한 이유는 사람의 경우는
수직보행을 통해 추간판이 천천히 튀어나와 신경을
압박하지만 강아지는 수평보행을 하기 때문에 급격히
추간판이 파열되듯이 발생하여 하지마비와 보행장애가
올 수 있습니다.
#강아지추간판탈출증
디스크 질환이 발생한 강아지는 주저 앉거나 기어다니고
보행이상과 배변, 배뇨 장애가 나타나게 됩니다.
또한 척추가 휘어져서 몸이 좌우로 기울거나 변형되는
모습을 보일 수 있습니다.
치료를 위해서는 수술 또는 비수술적인 치료방법을
택해야 하는데 강아지의 건강상태와 나이 등을 고려하여
담당 수의사의 결정에 따르는 것이 좋습니다.
특히 수술 후에도 재발의 위험성이 있기에 재활과 함께
꾸준한 관리가 필요합니다.
#강아지디스크수술
강아지의 근골격 구조는 평지에서 살 수 있도록 발달
되어 있기 때문에 점프나 높은 곳을 오르내리는 것은
관절에 무리를 주므로 이를 무리하게 시키지 않는 것이
좋습니다.
또한 앞서 말씀드린 디스크와 관절 질환에 취약한
품종의 강아지를 키우는 보호자께서는 평소 걸음
걸이와 행동에 대해 주의깊게 살펴보시는 것이
필요합니다.
조금이라도 이상 행동과 디스크, 관절 질환이 의심될
경우 에는 곧바로 동물병원으로 데리고 오셔서
검진을 받고 조기에 치료할 수 있도록 해주세요.
#강아지디스크치료
강남 지역민이시라면 TV동물농장 자문위원이신
최영민 원장님께 강아지의 효과적인 치료를
맡겨보세요~
#강남강아지동물병원
모든 동물을 특별하게 케어하는
최영민동물병원
진료문의는 전화로 안내해 드립니다.
최영민동물병원 오시는 길
50m
© NAVER Corp.
최영민동물의료센터
서울특별시 강남구 논현로132길 24 양현빌딩2층 최영민동물의료센터
이 블로그의 체크인
이 장소의 다른 글",https://m.blog.naver.com/vet6390/223187894761?referrerCode=1,https://mblogthumb-phinf.pstatic.net/MjAyMzA4MTlfNzQg/MDAxNjkyNDMxODYyMDE3.nsAqdwQLJNW77Wk5V00fJ5XTCQx-A5qn4R1_w5gHO0Ag.IWBpBpIuUpSaVuEVBIJ14O28sJuATdqqUGbjXD3cr2Qg.PNG.vet6390/%EA%B0%95%EC%95%84%EC%A7%80_%EB%94%94%EC%8A%A4%ED%81%AC_%EA%B4%80%EC%A0%88_%EC%A7%88%ED%99%98_%EC%B9%98%EB%A3%8C_%EA%B0%95%EB%82%A8%EB%8F%99%EB%AC%BC%EB%B3%91%EC%9B%90.PNG?type=w800
강아지 눈병 반려견 안과 질환 증상 체크 치료 강남 동물병원 추천,"강아지 눈병 반려견 안과 질환 증상 체크 치료 강남 동물병원 추천
강아지에게 눈병은 많이 발병하는 질환 중 하나입니다.
강아지에게 뇌나 신경질환이 발병하면 눈에 발현되어
안과 질환 처럼 증상이 보일 수도 있습니다.
#강아지눈병
예를 들어 눈에 떨림, 이상 외에도 경련과 발작이
동반되거나 동공이 열리고 눈의 좌우 대칭이
맞지 않는다면 뇌나 신경장애 또는 전정장애를
의심할 수 있습니다.
각막을 다치면 눈에 통증이 있고 눈을 자주
깜박이고 눈을 가늘게 뜨는데 이는 각막염,
포도막염, 망막박리 등을 의심할 수 있습니다.
#강아지눈통증
강아지가 자꾸 눈을 비비고 털이 눈을 찔러서
지속적인 자극을 주면 각막궤양이 발생할 수
있습니다.
노령견이 되면 눈의 노화가 시작되어 눈안이
하얗고 뿌옇게 보이는데 이는 백내장의 증상
입니다.
#강아지백내장증상
끈적이는 눈곱과 충혈, 눈물이 지속적으로 나고
가려움과 통증을 호소한다면 결막염, 각막염,
포도막염, 유루증, 체리아이, 홍역, 안검내반,
알레르기 등을 의심할 수 있습니다.
이처럼 강아지의 눈병 안과 질환은 종류가
다양하고 어떤 원인으로 어떤 상태인지 파악하는
것이 중요합니다.
원인을 파악하고 조기에 치료하는 것이 강아지의
눈건강을 지키는데 매우 중요한 요소 입니다.
왜냐하면 대다수의 안과 질환은 심해지면 치료와
회복이 더욱 어려워지기 때문입니다.
#강아지눈병안과
따라서 눈의 노화가 시작되는 8세 이상의 노령견의
경우 정기적인 안과검진이 꼭 필요합니다.
강남 지역민 이시라면 TV동물농장 자문위원이신
최영민 원장님께 강아지의 효과적인 치료를
받도록 해주세요.
#강남강아지동물병원
모든 동물을 특별하게 케어하는
최영민동물병원
진료문의는 전화로 안내해 드립니다.
최영민동물병원 오시는 길
50m
© NAVER Corp.
최영민동물의료센터
서울특별시 강남구 논현로132길 24 양현빌딩2층 최영민동물의료센터
이 블로그의 체크인
이 장소의 다른 글",https://m.blog.naver.com/vet6390/223185880257?referrerCode=1,https://mblogthumb-phinf.pstatic.net/MjAyMzA4MTdfMjUg/MDAxNjkyMjM4OTE3Nzk3.UZZvvyIQ1x4drClCL2Gs5-CdSXNITrHOyGb6RAkJhxIg.fI7uMPNXuJDofB-QAHdNOpYsUhV9tLV7dXl5ObIaDUYg.PNG.vet6390/%EA%B0%95%EC%95%84%EC%A7%80_%EB%88%88%EB%B3%91_%EC%A7%88%ED%99%98_%EC%B9%98%EB%A3%8C_%EC%95%88%EA%B3%BC.PNG?type=w800
나이든 강아지 노령견의 기침은 무슨 이유 의심증상 검진 강남 동물병원,"나이든 강아지 노령견의 기침은 무슨 이유 의심증상 검진 강남 동물병원
강아지가 나이가 들어 종종 기침을 하면 대수롭지
않게 넘어가는 경우가 많습니다.
기침은 호흡기 내부에 분비물과 이물질 축적을 막기
위한 방어기재로 나타납니다.
하지만 이런 기도에 이상 반응이 일정 시간 계속
지속되고 잦은 기침은 문제가 있는 반응이라 의심해
볼 수 있습니다.
#나이든강아지질환
노령견의 잦은 기침은 무슨 이유일까요?
우선 심장병을 의심해 볼 수 있습니다.
심장병 중 많은 빈도로 나타나는 울혈성 심부전은
심장의 비대에 따른 기관 압박과 폐부종으로 기침을
유발합니다.
이런 상태의 기침은 마른 기침인 경우가 많으며
주로 새벽과 저녁 때 자주 기침을 하는 경향이 있습니다.
또한 운동 직후 기침이 심해지며 자주 헐떡이며 쉽게
지치게 됩니다.
#노령견기침증상
심장병 중 이첨판폐쇄부전증은 심장의 노화로
인해 심장의 이첨판이 문제가 생겨 혈액이 좌심방
으로 역류하여 폐에 압력이 가해져 폐기능 약화로
심한 기침과 호흡곤란이 오게 됩니다.
기관허탈은 거위 울음소리 같은 기침소리를 내며
입에서 폐까지 이어져 있는 기관이 납작해지고
좁아지는 질환 입니다.
#강아지심장병
심장사상충도 의심 질환 중 하나입니다.
주기적인 구충 예방을 하면 괜찮지만 예방을
하지 않으면 걸리게 되어 폐렴이나 폐혈전증이
유발되어 기침이 나타납니다.
폐종양 역시 의심 질환인데 호흡이 가쁘고 기침을
자주 한다면 의심할 수 있습니다.
대부분 다른 장기에 종양이 폐로 전이되어 일어납니다.
#강아지폐질환
만성기관지염 역시 의심해 볼 수 있는데요.
주로 노령의 소형견에게 다발하며 지속적인 기침으로
기관지 염증이 심해지면서 기침은 더 심해지는
악순환이 연속됩니다.
이외에도 기침 유발 원인은 많습니다.
노령의 나이많은 강아지가 기침을 자주 한다면 이는
검진 대상 입니다.
치료 효과를 극대화하고 후유증을 최소화 하기 위해서는
정확한 진단이 필요하므로 꼭 동물병원으로 데리고
오셔서 검진을 받도록 해주세요.
#강남강아지병원
강남 지역민이시라면 TV동물농장 자문위원이신
최영민 원장님께 강아지의 효과적인 치료를 맡겨보세요
#강남강아지동물병원
모든 동물을 특별하게 케어하는
최영민동물병원
진료문의는 전화로 안내해 드립니다.
최영민동물병원 오시는 길
50m
© NAVER Corp.
최영민동물의료센터
서울특별시 강남구 논현로132길 24 양현빌딩2층 최영민동물의료센터
이 블로그의 체크인
이 장소의 다른 글",https://m.blog.naver.com/vet6390/223183827359?referrerCode=1,https://mblogthumb-phinf.pstatic.net/MjAyMzA4MTVfNDYg/MDAxNjkyMDI2NzU3MjM4.MgHL7zlNgFd4Sd1EJeLVEGPdpsmJvZQMuUug1XmE4hYg.UE7AFzXTsdvwDbWPT3-twSyd6NCViGsKnyzQHaaLUpwg.PNG.vet6390/%EB%82%98%EC%9D%B4%EB%93%A0_%EA%B0%95%EC%95%84%EC%A7%80_%EA%B8%B0%EC%B9%A8_%EC%B9%98%EB%A3%8C_%EA%B0%95%EB%82%A8_%EB%8F%99%EB%AC%BC%EB%B3%91%EC%9B%90.PNG?type=w800
강아지 귓병 외이염 원인과 검진 치료 잘하는 강남 동물병원,"강아지 귓병 외이염 원인과 검진 치료 잘하는 강남 동물병원
강아지는 귓병에 취약한 편 입니다.
그 원인은 이도라고 불리는 귓 속 통로의 벽이
사람에 비해 굉장히 민감하기 때문입니다.
외이도는 강아지의 피부 중에서 가장 취약한
곳으로 세균, 곰팡이, 기생충 감염이 잘 발생할 수
있기 때문에 외이염이 발생할 수 있습니다.
#강아지귓병
외이염과 같은 귓병에 걸린 강아지는 제대로
치료하지 않으면 쉽게 재발하고 강아지에게
악취와 분비물, 가려움증, 염증 등이 악화될 수
있습니다.
견종 중에 긴 외이도를 가진 경우와 외이도내에
조밀하게 귓털이 잘 자라는 견종의 경우 외이염에
취약한데 대표적인 견종은 푸들이나 테리어, 샤폐이
등이 있습니다.
#강아지귓병취약견종
외이염의 원인을 보면 가장 흔한 원인이 바로
아토피와 식이에 대한 과민반응이 있습니다.
이런 경우 동물병원에서 검진 후 처방 받은
증상완화제를 먹이거나 단백질에 대한 사료와
간식에 대해 살펴보고 처방식을 먹이는 것이
필요합니다.
잘못된 귀관리도 외이염의 문제가 될 수 있습니다.
이에 대해서는 동물병원에서 이도점막상태, 고막상태,
분비물의 성상, 2차 감염균 여부를 파악하고 적합한
세정제를 사용하는 것을 추천 드립니다.
#강아지귀청소
만일 강아지가 귀 청소를 너무 싫어하거나 제대로
닦였는지 확신이 없다면 동물병원에서 세정하는 것이
안전합니다.
외이염이 어느 정도 호전됐어도 귀 세정을 그만두지
말고 꾸준히 귀를 세정해주면서 주기적인 관리가
무엇보다 중요합니다.
만일 강아지의 귓병이 의심된다면 조기에 병원으로
데리고 오셔서 진료를 받도록 해주세요.
외이도염을 방치하여 만성 외이도염으로 외이도가
심하게 좁아지는 경우가 되면 일반적인 내과치료로도
효과가 없기 때문에 외과적인 수술을 필요로 할 수
있으므로 반드시 강아지 귓병은 수의사의 지시에
따라야만 합니다.
#강아지귓병치료동물병원
강남 지역민이시라면 TV동물농장 자문위원이신
최영민 원장님께 강아지의 효과적인 치료를 맡겨보세요
#강남강아지동물병원
모든 동물을 특별하게 케어하는
최영민동물병원
진료문의는 전화로 안내해 드립니다.
최영민동물병원 오시는 길
50m
© NAVER Corp.
최영민동물의료센터
서울특별시 강남구 논현로132길 24 양현빌딩2층 최영민동물의료센터
이 블로그의 체크인
이 장소의 다른 글",https://m.blog.naver.com/vet6390/223182605560?referrerCode=1,https://mblogthumb-phinf.pstatic.net/MjAyMzA4MTNfNTgg/MDAxNjkxOTE1ODcyMTAx.6Vv6ec05TtuOi4Rbpk6SW1KuN5j3Rrs5Ptv3aI0LAw0g.y1d7aRXRkErn4zxWhR7pzysG_wK0M7w2M_P89dijoM8g.PNG.vet6390/%EA%B0%95%EC%95%84%EC%A7%80_%EA%B7%93%EB%B3%91_%EC%B9%98%EB%A3%8C_%EA%B0%95%EB%82%A8%EB%8F%99%EB%AC%BC%EB%B3%91%EC%9B%90.PNG?type=w800
강아지 구토 기력쇠진 시 원인 의심 질병 대처법 치료 강남 동물병원,"강아지 구토 기력쇠진 시 원인 의심 질병 대처법 치료 강남 동물병원
강아지가 구토 후 기력쇠진의 증상을 보인다면
체크할 부분을 파악해 보셔야 합니다.
구토 전에 무엇을 먹었는지, 이물을 섭취한 것은
아닌지 살펴보고 이물을 섭취했거나 하루 3번 이상
구토가 지속된다면 바로 동물병원으로 데리고 오셔야
합니다.
#강아지구토
하지만 강아지가 구토 후에 기력쇠진 없이 정상적으로
식욕을 가지고 있다면 일단 관찰 하면서 상태를
지켜봐도 됩니다.
구토가 지속되지는 않지만 일주일에 2~3번씩 주기적인
구토가 반복된다면 사료교체와 간식도 교체해 주세요.
사료나 간식에 대한 알레르기 반응일 수 있기 때문입니다.
그럼에도 주기적인 구토가 지속된다면 동물병원에서
검진을 받아봐야 합니다.
#강아지구토원인
구토 후 토사물에 혈액이 섞여나온다면 신속한
동물병원 진료가 필요합니다.
또한 음식을 먹었을 때 곧바로 구토를 보인다면
기능성 위염이 의심되므로 병원에서 치료를 하면
개선될 수 있습니다.
어린 새끼 강아지가 구토를 하고 기력쇠진을 보인다면
이는 응급상황 입니다.
어떤 바이러스성 질환으로 인해 위장염을 동반할 수
있기 때문에 탈수가 일어나지 않도록 검진과 수액치료가
필요할 수 있습니다.
#강아지구토치료
산책 후 구토는 산책 시 이물을 먹었을 수 있습니다.
특히 사료와 비슷하게 생긴 유박비료를 섭취했을 때
구토를 유발하기 때문입니다.
또한 자동차 밑에 흘려진 부동액을 핥아 먹을 경우도
구토를 유발합니다.
부동액을 핥으면 단맛을 느끼므로 이를 먹을 경우
심각한 중독증상을 야기하여 급성 신부전을 일으킬 수
있습니다.
급성 신부전은 요독증과 구토를 유발하므로 응급상황
이기에 빠르게 동물병원에서 조치가 필요합니다.
#강아지응급상황
위와 같은 형태의 구토를 강아지가 보인다면
섭취물이 무엇인지, 구토와 증상, 설사유무, 구토의 횟수,
기력쇠진의 현상에 대해 체크하시고 토사물을 사진
찍어 동물병원으로 데리고 오셔서 상담하시면
더욱 빠른 진단과 치료에 효과적입니다.
반려견의 보호자 분들께서는 이점을 잊지 마시고
체크해 주시길 바랍니다.
강남에서 반려동물 치료를 전문적으로 하는 동물병원을
찾으신다면 최영민동물병원으로 오시면 됩니다.
#강남강아지치료병원
모든 동물을 특별하게 케어하는
최영민동물병원
진료문의는 전화로 안내해 드립니다.
최영민동물병원 오시는 길
50m
© NAVER Corp.
최영민동물의료센터
서울특별시 강남구 논현로132길 24 양현빌딩2층 최영민동물의료센터
이 블로그의 체크인
이 장소의 다른 글",https://m.blog.naver.com/vet6390/223181903737?referrerCode=1,https://mblogthumb-phinf.pstatic.net/MjAyMzA4MTJfOTMg/MDAxNjkxODI1Mjk0OTI2.GrgPSOBZazEuv8f0BBLNWXPn8qDU3tN1PbeDv8TOFNMg.eUhAJQVZgX_Gdxi-qImp6MV1H_Zs-aC68YgT-YzK3_Eg.PNG.vet6390/%EA%B0%95%EC%95%84%EC%A7%80_%EA%B5%AC%ED%86%A0_%EC%B9%98%EB%A3%8C_%EA%B0%95%EB%82%A8%EB%8F%99%EB%AC%BC%EB%B3%91%EC%9B%90.PNG?type=w800
