title,content,URL,image
강아지 탈모 가려움증 원인 곰팡이성 피부병 원인 치료 강남 동물병원,"강아지 탈모 가려움증 원인 곰팡이성 피부병 원인 치료 강남 동물병원
강아지가 흔하게 겪는 질환 중 하나가 피부병
입니다.
강아지가 피부병에 걸리면 주요 증상은 탈모와
가려움증을 보이는데요.
이외에도 비듬도 보이고 가려움증으로 심하게
긁다 보면 상처가 생겨서 세균감염이 될 수 있습니다.
#강아지탈모
이러한 강아지 피부병의 원인 중 곰팡이균이 원인이
되는 경우가 가장 많습니다.
강아지 곰팡이 피부병은 피부 각질층, 털 그리고 발톱에
진균(곰팡이)이 침입하여 발생하는 피부질환 입니다.
때로는 다른 피부병과 복합 감염되는 경우도 많습니다.
진균성 피부병은 사람에게도 감염되기 때문에 발견
즉시 격리 수용하며 조기 치료를 실시해야 합니다.
#강아지진균성피부병
강남 강아지 최영민 동물병원은 피부병의 원인 검사를
전문의의 축적된 임상경험과 실력을 통해, 최신 설비와
최첨단장비로 반려동물에게 발병하는 다양한 피부관련
질병을 정확하게 검진, 치료하고 있습니다.
#강아지피부병
검사를 정확히 판별하여 소독을 하고 먹는 약과 바르는
연고를 처방하여 치료 관리 합니다.
약물 치료를 통해 가려움증을 완화시키면서 피부병
증상을 완화할 수 있습니다.
곰팡이는 모낭의 영양을 먹고 자라기 때문에 모낭에
손상이 와서 감염 부위의 털이 동그랗게 빠지고 딱지나
비듬이 보입니다.
또한 가렵기 때문에 스트레스도 심하게 받기 때문에
조기에 치료가 필요합니다.
#강아지피부병치료
곰팡이성 피부염은 재발이 잦은데다 치료가 오래 걸릴
수 있으므로 피부병이 깊어지기 전에 조기에 치료할 수
있도록 빨리 동물병원으로 데리고 오시길 권해 드립니다.
TV동물농장 자문위원이신 최영민 원장님께 강아지를
위한 효과적인 치료를 받도록 해주세요~
#강남강아지동물병원
모든 동물을 특별하게 케어하는
최영민동물병원
진료문의는 전화로 안내해 드립니다.
최영민동물병원 오시는 길
최영민동물의료센터
서울특별시 강남구 논현로132길 24 양현빌딩2층 최영민동물의료센터
이 블로그의 체크인
이 장소의 다른 글",https://m.blog.naver.com/vet6390/223206908835?referrerCode=1,https://mblogthumb-phinf.pstatic.net/MjAyMzA5MDlfMjM4/MDAxNjk0MjU2NjkxMzY0.tMfLbdp0QWelWRx6zJrmEAEz4cQ8xkFntQ3ouaP65wog.lt6be9RASGugnZsFQPoqDiQ8VvpedRteZ2mCwR2SwKEg.PNG.vet6390/%EA%B0%95%EB%82%A8_%EA%B0%95%EC%95%84%EC%A7%80_%ED%94%BC%EB%B6%80%EB%B3%91_%EC%B9%98%EB%A3%8C.PNG?type=w800
강아지 구토 설사 원인 식중독 증상 치료 강남 동물병원,"강아지 구토 설사 원인 식중독 증상 치료 강남 동물병원
강아지가 식중독에 걸리면 나타나는 대표적인 증상은
구토와 설사 증상 입니다.
특히 사료 관리를 잘 못해서 사료가 산패 하거나
이물질이 들어가는 경우에 식중독에 걸릴 가능성이
높습니다.
#강아지식중독
식중독이 발병하면 구토와 설사 외에도 장염으로
악화되어 탈수가 되어 기력쇠진으로 축 늘어지게
됩니다.
이밖에도 식욕부진, 피부발진, 부종 등이 나타날 수
있고 심할 경우 다른 질환이 동반되거나 호흡곤란이
오기도 합니다.
#강아지식중독증상
식중독이 의심될 때는 우선 물을 제외하고는 음식을
주지말고 금식을 시켜야 합니다.
또한 식중독 증상이 나타났다면 바로 동물병원에
데리고 오셔서 치료를 받도록 해주세요.
#강아지식중독치료
사료를 상온에 오래 두면 각종 세균에 의해 부패
하는데 건사료를 제대로 밀봉하지 않으면 곰팡이가
생기고 부패하는 것을 잘 알고 계셔야 합니다.
사료는 잘 밀봉하여 서늘한 곳에 보관토록 해야
합니다.
식중독 예방을 위해 청결한 환경도 중요합니다.
반려견이 지내는 장소와 사용하는 도구를 항상 깨끗
하게 청소하고 세척 후 건조해 줘야 합니다.
#강아지식중독관리
또한 강아지가 아무것나 먹지 못하도록 세심하게
관찰하며 사람이 먹는 음식을 아무거나 막 줘서도
안됩니다.
식중독은 보호자가 관리를 통해 예방할 수 있습니다.
그럼에도 불구하고 구토, 설사 등 식중독 의심 증상이
나타나면 언제 증상이 나타났고 무엇을 먹었는지
잘 체크하여 동물병원에 데리고 오셔서 수의사에게
알려주시는 것이 빠른 진료와 치료에 도움이 됩니다.
#강아지식중독치료병원
모든 동물을 특별하게 케어하는
최영민동물병원
진료문의는 전화로 안내해 드립니다.
최영민동물병원 오시는 길
50m
© NAVER Corp.
최영민동물의료센터
서울특별시 강남구 논현로132길 24 양현빌딩2층 최영민동물의료센터
이 블로그의 체크인
이 장소의 다른 글",https://m.blog.naver.com/vet6390/223204684520?referrerCode=1,https://mblogthumb-phinf.pstatic.net/MjAyMzA5MDdfMTMw/MDAxNjk0MDQ2MjU0NDk1.b9HKSEX-U0s27gVk0y6e1gcLn5mHmsZJVEEMuSN8GB8g.bVHIOCesHScJK6ye9i52dz_6dhHKoqU_0tAn6bJRCf8g.PNG.vet6390/%EA%B0%95%EB%82%A8_%EA%B0%95%EC%95%84%EC%A7%80_%EC%8B%9D%EC%A4%91%EB%8F%85_%EC%B9%98%EB%A3%8C_%EB%8F%99%EB%AC%BC%EB%B3%91%EC%9B%90.PNG?type=w800
강아지 구강종양 증상 입안에 발생한 구강암 반려견 치료 강남동물병원,"강아지 구강종양 증상 입안에 발생한 구강암 반려견 치료 강남동물병원
강아지 압안에 종양이 발생할 수 있는데 입안 뿐 아니라
입술이나 혀, 잇몸, 구강 내 림프조직에 생기는 종양을
구강종양 이라고 합니다.
#강아지구강종양
종양은 크게 악성과 양성으로 나뉘어 지는데
악성이 아니더라도 조기에 치료하지 않으면
악성이 되어서 다른 기관에 전이될 수 있으므로
주의가 필요합니다.
양성은 잇몸에 생기는 에프리스, 유두종이 있으며
악성은 악성 흑색종, 편평상피암, 섬유육종 등이 있습니다.
#강아지구강암
구강종양이 발생하면 몇가지 증상을 보이는데
대표적으로 입안에 혹이나 종기가 생겨 점막이
문드러져 보이며 과도한 침흘림과 구내에 악취가
풍깁니다.
음식물을 잘 먹지 못하며 이로인해 체중이 감소하며
식욕김퇴가 일어납니다.
입에서 피가 나며 잘 씹지 못하고 입을 열고 다무는
것을 잘 못합니다.
물론 종양이 있어도 아무런 증상을 보이지 않을 수도
있습니다.
#강아지입냄새심한이유
악성 종양인 흑색종의 경우 점막이나 혀에 발생하며
검은 색의 종양의 모습으로 급속하게 성장하여
폐나 림프관에 전이되는 경우가 많습니다.
치료를 위해서는 동물병원에서 검사를 통해
양성인지 음성인지 판별해야 합니다.
악성 종양의 경우 수술을 통해 제거해야 하는데
만일 시기가 늦어 턱뼈까지 번지게 되면 턱뼈도
포함해서 종양을 적출해야 합니다.
#강아지구강암수술
빠르게 발견하여 조기에 수술과 방사선 치료를 하면
높은 성공률로 예후가 좋습니다.
하지만 늦게 발견하여 악성종양이 후기로 판명되면
항암 화학요법이나 방사선 치료법을 병행하여
치료율은 종양의 종류와 위치, 전이 여부에 따라
상이하게 달라질 수 있습니다.
따라서 보호자는 치아관리를 위해 칫솔질을 해주면서
입안에 종기나 궤양은 없는지 살펴봐 주시길 바랍니다.
#강아지구강암예방
TV동물농장 자문위원이신 최영민 원장님께 강아지를
위한 효과적인 치료를 받도록 해주세요~
#강남강아지동물병원
모든 동물을 특별하게 케어하는
최영민동물병원
진료문의는 전화로 안내해 드립니다.
최영민동물병원 오시는 길
50m
© NAVER Corp.
최영민동물의료센터
서울특별시 강남구 논현로132길 24 양현빌딩2층 최영민동물의료센터
이 블로그의 체크인
이 장소의 다른 글",https://m.blog.naver.com/vet6390/223202258679?referrerCode=1,https://mblogthumb-phinf.pstatic.net/MjAyMzA5MDRfMTc3/MDAxNjkzODE5MzM0NDY5.1Pw67wtpt_m6_dUJP2BGSjHYqYy5fooIz3iv8cMLeucg.arpJuzBzOSEiGxSZAG9iRdYsfTxuJ0bjo21xu7EEM_8g.JPEG.vet6390/%EA%B0%95%EB%82%A8_%EA%B0%95%EC%95%84%EC%A7%80_%EA%B5%AC%EA%B0%95%EC%95%94_%EC%B9%98%EB%A3%8C.jpg?type=w800
강아지 귀질환 이개혈종 귀가 붓고 통증 있는 귓병 치료 강남동물병원,"강아지 귀질환 이개혈종 귀가 붓고 통증 있는 귓병 치료 강남동물병원
강아지 귀질환은 여러가지 증상으로 나타나는데요.
이중 이개혈종은 매우 흔한 강아지 귓병으로 귀를
계속 뒷발로 긁고 냄새를 맡으며 귀를 자주 흔들어
대는 모습을 보입니다.
#강아지귀질환
이개혈종이 나타나면 강아지의 귀는 퉁퉁 부어오르며
귀를 수시로 흔들어 대묘 벽면이나 바닥 등에 귀를
비벼 대기도 합니다.
귓바퀴에 혈관이 파괴되기 때문에 내출혈로 인해
귀가 퉁퉁 붓고 낑낑 거리며 통증으로 괴로워 합니다.
#강아지귀통증
피고름이 강아지의 귀에 가득차기 때문에 보호자가
만지면 매우 괴로워합니다.
이러한 이개혈종은 특히 큰 귀를 가진 품종에서
발생하기 쉽습니다.
#강아지이개혈종
귀에 심한 자극과 충격이 지속되면 귀에 혈종이
생기는데 이를 제때 제거하지 않으면 연골막에서
새로운 연골이 형성되며 섬유화가 진행됩니다.
이로인해 귀모양이 변하게 되는데 유도나 레슬링을
하는 선수들의 귀모양이 이런 이유 때문입니다.
이런 귀를 일면 만두귀라고 부르는데 귀가 마치
만두처럼 부풀어 오르기 때문입니다.
#강아지귓병
이개혈종의 치료는 피고름을 빼내는 치료를 하고
1주 이상 붕대로 고정해야 합니다.
문제는 관리가 필요한데 붕대를 자꾸 강아지가
풀어버리고 귀를 다시 긁으면서 재발하는 경우가
많습니다.
#강아지귓병치료
따라서 강아지 이개혈종 치료는 치료 뿐 아니라
관리가 매우 중요합니다.
자주 붕대를 갈아주고 병원에 주기적으로 내원하여
신경을 써야 하므로 보호자의 관심이 필요한 질환이
강아지 이개혈종 귀질환 입니다.
#강아지귀치료동물병원
TV동물농장 자문위원이신 최영민 원장님께 강아지를
위한 효과적인 치료를 받도록 해주세요~
#강남강아지동물병원
모든 동물을 특별하게 케어하는
최영민동물병원
진료문의는 전화로 안내해 드립니다.
최영민동물병원 오시는 길
50m
© NAVER Corp.
최영민동물의료센터
서울특별시 강남구 논현로132길 24 양현빌딩2층 최영민동물의료센터
이 블로그의 체크인
이 장소의 다른 글",https://m.blog.naver.com/vet6390/223199844340?referrerCode=1,https://mblogthumb-phinf.pstatic.net/MjAyMzA5MDFfODkg/MDAxNjkzNTU5Njc2Nzk3.K9P52q9OXMdA_P9amaeMnU2nxCzoJnnIrwxvp9Nbzxcg.EDLc6ztHWupAs-1-1s1Si30XEG1FW_HBfviU8Yr0SpIg.PNG.vet6390/%EA%B0%95%EC%95%84%EC%A7%80_%EA%B7%80%EC%A7%88%ED%99%98_%EC%9D%B4%EA%B0%9C%ED%98%88%EC%A2%85_%EC%B9%98%EB%A3%8C_%EA%B0%95%EB%82%A8%EB%8F%99%EB%AC%BC%EB%B3%91%EC%9B%90.PNG?type=w800
강아지 잇몸색 구강관리 건강 상태 체크,"강아지 잇몸색 구강관리 건강 상태 체크
일반적인 건강한 강아지의 잇몸은 깨끗한 분홍색을
띄면서 촉촉하고 매끈합니다.
하지만 다른 색의 잇몸을 보인다면 강아지의 건강
이상을 체크할 수 있습니다.
#강아지잇몸색
검은색 잇몸은 선천성으로 보일 수도 있는데
차우차우나 샤폐이 같은 견종의 경우 날때부터
잇몸이 검고 어두울 수 있습니다.
하지만 후천적으로 몸에 별다른 문제가 없어도
나이가 들면서 자연스럽게 잇몸이 어둡게
변할 수 있습니다.
단 갑자기 검은 반점이 생기거나 검은 부분이
부푼다면 구강종양인 흑색종을 의심해야 합니다.
#강아지구강관리
붉은 색의 잇몸은 딱딱한 음식이나 물건을
씹는 과정에서 치은염, 구내염, 열사병을
의심해 볼 수 있습니다.
창백한 잇몸은 빈혈이 발생하면 생깁니다.
빈혈의 원인은 외상과 혈뇨, 내부출혈로
발생하거나 골수문제로 기능이 떨어지고
신부전, 종양 등이 골수를 억압하게 되면
빈혈이 발생합니다.
이외에도 참진드기에 물려서 바베시아증이
발병하면 빈혈이 생길 수 있습니다.
#강아지건강상태
잇몸이 창백하면 목숨이 위험할 정도로 심각한
문제가 있을 가능성이 크기 때문에 즉시 동물병원에
방문하는 것이 꼭 필요합니다.
잇몸이 파란색, 보라색으로 변할 수 있습니다.
이런 증상을 청색증이라고 하는데 산소가 부족한
상태이므로 서둘러 치료를 받는 것이 필요합니다.
#강아지구강치료
노란색 잇몸은 황달의 증상 입니다.
간경화나 간염 등 간이 손상되면 노란색 잇몸을
띄게 됩니다.
위와 같이 잇몸 색이 변하면 건강 상태의 이상신호
이므로 보호자의 세심한 관찰과 동물병원으로
빨리 데려가시는 것이 중요합니다.
TV동물농장 자문위원이신 최영민 원장님께 강아지
를 위한 효과적인 치료를 받도록 해주세요~
#강남강아지동물병원 #강아지건강검진
모든 동물을 특별하게 케어하는
최영민동물병원
진료문의는 전화로 안내해 드립니다.
최영민동물병원 오시는 길
50m
© NAVER Corp.
최영민동물의료센터
서울특별시 강남구 논현로132길 24 양현빌딩2층 최영민동물의료센터
이 블로그의 체크인
이 장소의 다른 글",https://m.blog.naver.com/vet6390/223197479340?referrerCode=1,https://mblogthumb-phinf.pstatic.net/MjAyMzA4MzBfMjY5/MDAxNjkzMzY0MDQ4MzQ2.pUTaZnmcpVNH0bn_WvZ1-WeFti89PHU62cfilAfinYwg.XQJWmEhsPFiZcEFo6Bkjmupu5WAoPoWGGFnwj2rgoH0g.PNG.vet6390/%EA%B0%95%EC%95%84%EC%A7%80_%EC%9E%87%EB%AA%B8%EC%83%89_%EA%B5%AC%EA%B0%95%EA%B4%80%EB%A6%AC.PNG?type=w800
강아지 운동장애 경련 사비마비 발작 증상 원인 뇌수두증 치료 강남동물병원,"강아지 운동장애 경련 사비마비 발작 증상 원인 뇌수두증 치료 강남동물병원
강아지가 경련을 지속하고 의식을 잃는 사례가
빈번하다면 뇌수두증을 의심하고 MRI 검진을
통해 면밀히 살펴봐야 합니다.
#강아지운동장애경련
뇌수두증의 증상은 강아지가 식욕저하, 수면증가,
활동저하, 운동장애, 둔감, 시각소실, 우울감과 흥분
의식변화, 시각장애, 강직성 마비, 발작 등이
나타날 수 있습니다.
뇌수두증의 원인은 뇌의 뇌실에 뇌척수액이
채워져 있어야 하지만 뇌척수액의 흐름이 막혀 있거나
생성과 흡수의 균형이 깨져 뇌압이 상승하는 경우
뇌수두증이 발생합니다.
#강남강아지수술병원
뇌수두증의 치료를 위해서는 약물이나 수술로 증상을
완화할 수 있는데 약물치료는 수술이 불가능하거나
급성 증상이 나타날 때 시도해볼 수 있습니다.
약물로 뇌척수액의 생산을 줄이고 발작이 동반된 경우
항경련제를 처방합니다.
#강남강아지뇌수두증치료
약물은 내성이 생기거나 전해질 장애가 나타날 수
있어 장기간 사용은 치료반응을 저하할 수 있습니다.
수술적인 방법은 뇌실에 복강과 연결되는 관을 삽입해
뇌실 내 과하게 축적되는 뇌척수액을 복강으로 배액
하여 지속적인 감압이 이뤄질 수 있게 합니다.
수술 후 감염이나 배액관의 폐색, 과배액으로 인한
뇌압 감소와 같은 부작용이 발생할 수 있어 증상에
대한 면밀한 모니터링이 필요합니다.
#강아지발작원인치료
선천적으로 발생하는 뇌수두증은 주로 사과처럼
둥근 머리를 하고 주둥이가 짧은 치와와나 포메라니안,
시추, 몰티즈와 같은 소형견에게서 선천적으로
뇌구조 이상으로 발생하는 경우가 많기 때문에
보호자의 주의가 필요합니다.
TV동물농장 자문위원이신 최영민 원장님께 강아지를
위한 효과적인 치료를 받도록 해주세요~
#강남강아지동물병원
모든 동물을 특별하게 케어하는
최영민동물병원
진료문의는 전화로 안내해 드립니다.
최영민동물병원 오시는 길
50m
© NAVER Corp.
최영민동물의료센터
서울특별시 강남구 논현로132길 24 양현빌딩2층 최영민동물의료센터
이 블로그의 체크인
이 장소의 다른 글",https://m.blog.naver.com/vet6390/223195795296?referrerCode=1,https://mblogthumb-phinf.pstatic.net/MjAyMzA4MjhfMTUz/MDAxNjkzMjExNDIyNjY2.zxutAn16jFz_tM4JM_sOElkBb_IZx7m67anBkevxL2Ug.5RlprrnTyZhClTCQajcj6Df-p0E7xNbqgRGjO8XLvNkg.PNG.vet6390/%EA%B0%95%EC%95%84%EC%A7%80_%EB%B0%9C%EC%9E%91_%EA%B2%BD%EB%A0%A8_%EC%9A%B4%EB%8F%99_%EC%9E%A5%EC%95%A0_%EC%B6%94%EC%B2%9C.PNG?type=w800
강아지 기력쇠진 체중감소 당뇨병 증상과 검진 치료 관리 강남동물병원,"강아지 기력쇠진 체중감소 당뇨병 증상과 검진 치료 관리 강남동물병원
강아지 당뇨병은 비만, 유전, 췌장의 손상, 감염 등의
원인으로 체내 에너지대사에 문제가 생기는 질환입니다.
채내의 췌장에서는 인슐린 호르몬을 분비하면서 혈당
수치를 내립니다.
이렇게 분비되는 인슐린 호르몬이 부족하면 당뇨병이
발병 합니다.
#강아지당뇨병
강아지가 당뇨병에 걸리면 식욕과 소변양 증가하고
무기력함과 기력쇠진 그리고 체중이 감소되는 것이
가장 대표적인 증상 입니다.
혈당이 급격하게 떨어지면서 먹는 것을 통해 체내
에너지원인 당을 공급받기 때문에 끊임없이 먹으려고
하지만 먹는 것에 반해서 살이 찌지 않고 체중감소를
보입니다.
이런 증상들이 보이면 꼭, 병원에 데리고 오셔서
혈액, 소변 검사를 받아봐야 합니다.
#강아지체중감소원인
동물병원에서 검진 후 당뇨병이 판명되면 혈당에 맞게
사료량과 인슐린양을 알려 드립니다.
정해진 사료량을 급여하면서 인슐린 주사를 놓아 주게
됩니다.
진료 시 인슐린의 사용법, 주사법, 보관법 등애 대한
보호자 교육이 이루어지며 일단 혈당이 안정적으로
잡히면 매 6개월 마다 다시 내원하여 혈당을 재측정
하게 됩니다.
#강아지당뇨관리
강아지 당뇨병은 적정량의 인슐린만 잘 주사한다면
충분히 오랜 기간 건강한 생존이 가능한 질병입니다.
하지만 당뇨병은 제대로 관리가 되지 않으면
당뇨병성 케톤산증 그리고 고혈당성 고삼투압 등이
진행되게 되는데 심각하면 사망에 이르는 무서운 질환
입니다.
따라서 꼭 강아지가 당뇨 증상을 보이면 동물병원으로
데리고 오셔서 검진 후 관리에 대한 상담을 받도록 하세요.
강아지 당뇨는 반려인의 관심과 사랑, 철저한 관리가
필요한 병이라는 점을 잊지 마세요.
#강남강아지치료병원
강아지 당뇨병의 치료는 기본적으로 식사요법과
인슐린투여를 통해 해야 하므로 강남 지역민이시라면
최영민 동물병원에서 수의사의 지시와 권고사항에
따라 투여를 진행하시길 권해 드립니다.
TV동물농장 자문위원이신 최영민 원장님께 강아지를
위한 효과적인 치료를 받도록 해주세요~
#강남강아지동물병원
모든 동물을 특별하게 케어하는
최영민동물병원
진료문의는 전화로 안내해 드립니다.
최영민동물병원 오시는 길
50m
© NAVER Corp.
최영민동물의료센터
서울특별시 강남구 논현로132길 24 양현빌딩2층 최영민동물의료센터
이 블로그의 체크인
이 장소의 다른 글",https://m.blog.naver.com/vet6390/223194812026?referrerCode=1,https://mblogthumb-phinf.pstatic.net/MjAyMzA4MjdfMjE0/MDAxNjkzMTI0MzQ3MzYz.xNSst4qRmgxqyiZdEr64nWOWz9KMOkPb4ElcUaqQErog.IaFbZId3YGObbxOzMo7K-CacRbj7H-7-5F40BuoktjIg.PNG.vet6390/%EA%B0%95%EB%82%A8_%EA%B0%95%EC%95%84%EC%A7%80_%EB%8B%B9%EB%87%A8%EB%B3%91_%EC%B9%98%EB%A3%8C_%EB%8F%99%EB%AC%BC%EB%B3%91%EC%9B%90.PNG?type=w800
새끼 강아지 폐렴 의심 증상 기침 콧물 구토 치료 강남동물병원,"새끼 강아지 폐렴 의심 증상 기침 콧물 구토 치료 강남동물병원
폐렴이란 폐에 염증이 생기는 질환 입니다.
페렴이 발병하면 심한 발열이 먼저 나타나며 심하면
호흡곤란으로 이어지면서 사망에 이를 수 있는데
어린 새끼 강아지에게는 매우 위험한 질병입니다.
#강아지폐렴
어린 강아지가 기침과 같은 가벼운 증상을 보일 때
조기에 병원에 데려와 폐렴으로 진행되지 않도록
적절한 치료를 받아야 합니다.
#강남강아지폐렴치료
강아지가 폐렴에 걸리는 다음과 같은 증상을 보입니다.
✓ 기침
✓ 누런 가래 배출
✓ 거친 숨소리
✓ 발열
✓ 식욕저하
✓ 체중감소
✓ 콧물
✓ 구토
#강아지폐렴증상
폐렴이 중증이 되면 폐속에 공기가 차기도 하기
때문에 배가 부풀어 오르는 증상을 보일 수도
있습니다.
만일 어린 강아지가 기침을 하고 숨소리가 좋지
않다면 빨리 병원으로 데려와 진료를 받도록 해주세요.
검진 후에 항생제, 진핵제, 거담제, 소염제 등을 투여
하고 안정을 취하는 치료를 합니다.
#강남강아지치료병원
강아지 폐렴을 일으키는 세균은 면역력이 약해지고
감기에 걸렸을 때 발병이 진행됩니다.
또한 전염성이 강하기 때문에 면역력이 약한
어린 새끼 강아지나 나이든 노령견은 더욱 취약합니다.
앞서 말씀 드린 증상이 의심될 시에는 집에 방치하지
마시고 반드시 병원으로 데리고 오세요.
강남 지역민들께서는 TV동물농장 자문위원이신
최영민 원장님께 강아지를 위한 효과적인 치료를
받도록 해주세요~
#강남강아지동물병원
모든 동물을 특별하게 케어하는
최영민동물병원
진료문의는 전화로 안내해 드립니다.
최영민동물병원 오시는 길
50m
© NAVER Corp.
최영민동물의료센터
서울특별시 강남구 논현로132길 24 양현빌딩2층 최영민동물의료센터
이 블로그의 체크인
이 장소의 다른 글",https://m.blog.naver.com/vet6390/223194191073?referrerCode=1,https://mblogthumb-phinf.pstatic.net/MjAyMzA4MjZfMiAg/MDAxNjkzMDQyODgxMTEx.4Jx4W9MDfubVR_3P2aW56n5_fAjHTMO1Vf3139hlM2Qg.8liXmCUM5BbvqBm2DjyvsrYpdNkZNrKd1RwZ7cLSs_og.PNG.vet6390/%EA%B0%95%EC%95%84%EC%A7%80_%ED%8F%90%EB%A0%B4_%EC%A6%9D%EC%83%81_%EC%B9%98%EB%A3%8C.PNG?type=w800
